JLPT,Example Words,Onyomi,Word,Reading,Word Type,Example Sentence EN,breakdown,type,Lesson,Meaning,Kanji,Example Sentence JP,Kunyomi
N5,,,夏,なつ,Noun,Summer is very hot.,"{""vocabulary"": [{""word"": ""夏"", ""reading"": ""なつ"", ""meaning"": ""summer"", ""role"": ""Noun"", ""components"": [], ""combined_explanation"": """"}, {""word"": ""は"", ""reading"": ""は"", ""meaning"": ""[Topic Marker]"", ""role"": ""Particle"", ""components"": [], ""combined_explanation"": """"}, {""word"": ""とても"", ""reading"": ""とても"", ""meaning"": ""very"", ""role"": ""Adverb"", ""components"": [], ""combined_explanation"": """"}, {""word"": ""暑い"", ""reading"": ""あつい"", ""meaning"": ""hot"", ""role"": ""Adjective, present tense"", ""components"": [], ""combined_explanation"": """"}, {""word"": ""です"", ""reading"": ""です"", ""meaning"": ""is"", ""role"": ""Copula"", ""components"": [], ""combined_explanation"": """"}], ""grammar"": {""context"": ""This sentence describes the season of summer, emphasizing its characteristic of being very hot. It conveys a general observation about the weather during this time."", ""steps"": [""**夏** - Refers to the season of summer."", ""**は** - Marks “夏” as the topic of the sentence."", ""**とても** - An adverb that intensifies the adjective that follows, meaning “very.”"", ""**暑い** - An adjective describing the temperature, meaning “hot.”"", ""**です** - A polite ending particle that functions as the verb “is,” making the sentence more formal.""], ""sentence_pattern"": ""- [Topic] + [は] + [Adverb] + [Adjective] + [です]\n- **Kanji**: 冬はとても寒いです。\n- **Hiragana**: ふゆはとてもさむいです。\n- **English Translation**: Winter is very cold."", ""sentence_pattern_kanji"": ""冬はとても寒いです。"", ""sentence_pattern_hiragana"": ""ふゆはとてもさむいです。"", ""sentence_pattern_english"": ""Winter is very cold."", ""contribution"": """"}, ""tips"": {""tip"": ""Remember that は marks the topic of the sentence, which helps to focus on what the sentence is about. In this case, it highlights summer as the subject of discussion."", ""common_mistake"": ""Beginners often confuse the use of です with other verbs. Remember that です is used to link the subject with a description or state, making it essential for polite sentences."", ""alternative_expression"": {""kanji"": ""夏は非常に暑いです。"", ""hiragana"": ""なつはひじょうにあついです。"", ""english"": ""Summer is extremely hot.""}, ""new_words_in_alternative"": [{""word"": ""非常に"", ""reading"": ""ひじょうに"", ""meaning"": ""extremely"", ""description"": ""Adverb""}]}}",Vocab,4,summer,,夏はとても暑いです。,
N5,,,有名,ゆうめい,Na-adjective,He is a famous singer.,"{""vocabulary"": [{""word"": ""彼"", ""reading"": ""かれ"", ""meaning"": ""he"", ""role"": ""Pronoun"", ""components"": [], ""combined_explanation"": """"}, {""word"": ""は"", ""reading"": ""は"", ""meaning"": ""[Topic Marker]"", ""role"": ""Particle"", ""components"": [], ""combined_explanation"": """"}, {""word"": ""有名"", ""reading"": ""ゆうめい"", ""meaning"": ""famous"", ""role"": ""Adjective"", ""components"": [], ""combined_explanation"": """"}, {""word"": ""な"", ""reading"": ""な"", ""meaning"": ""[Adjective connector]"", ""role"": ""Particle"", ""components"": [], ""combined_explanation"": """"}, {""word"": ""歌手"", ""reading"": ""かしゅ"", ""meaning"": ""singer"", ""role"": ""Noun"", ""components"": [], ""combined_explanation"": """"}, {""word"": ""です"", ""reading"": ""です"", ""meaning"": ""is"", ""role"": ""Copula"", ""components"": [], ""combined_explanation"": """"}], ""grammar"": {""context"": ""This sentence states that the subject, referred to as \""he,\"" is identified as a famous singer. It provides information about his profession and reputation."", ""steps"": [""**彼** - Refers to the subject of the sentence, meaning \""he.\"""", ""**は** - Marks \""彼\"" as the topic of the sentence."", ""**有名** - An adjective meaning \""famous.\"""", ""**な** - Connects the adjective \""有名\"" to the noun \""歌手,\"" indicating that the noun is being described by the adjective."", ""**歌手** - The noun meaning \""singer.\"""", ""**です** - A copula used to link the subject and the predicate, indicating a state of being.""], ""sentence_pattern"": ""- [Topic] + [は] + [Adjective] + [な] + [Noun] + [です]\n- **Kanji**: 彼は学生です。\n- **Hiragana**: かれはがくせいです。\n- **English Translation**: He is a student."", ""sentence_pattern_kanji"": ""彼は学生です。"", ""sentence_pattern_hiragana"": ""かれはがくせいです。"", ""sentence_pattern_english"": ""He is a student."", ""contribution"": """"}, ""tips"": {""tip"": ""Remember that the structure \""Adjective + な + Noun\"" is a common way to describe nouns in Japanese. The \""な\"" connects the adjective to the noun it modifies."", ""common_mistake"": ""Beginners often forget to use \""な\"" when connecting an adjective to a noun. Always check if the adjective is modifying a noun to ensure proper structure."", ""alternative_expression"": {""kanji"": ""彼は著名な歌手です。"", ""hiragana"": ""かれはちょめいなかしゅです。"", ""english"": ""He is a well-known singer.""}, ""new_words_in_alternative"": [{""word"": ""著名"", ""reading"": ""ちょめい"", ""meaning"": ""well-known"", ""description"": ""Adjective""}]}}",Vocab,4,famous,,彼は有名な歌手です。,
N5,,,まっすぐ,まっすぐ,Adverb (fukushi),Please go straight.,"{""vocabulary"": [{""word"": ""まっすぐ"", ""reading"": ""まっすぐ"", ""meaning"": ""straight"", ""role"": ""Adverb"", ""components"": [], ""combined_explanation"": """"}, {""word"": ""行って"", ""reading"": ""いって"", ""meaning"": ""go"", ""role"": ""Verb, te-form"", ""components"": [{""part"": ""行く"", ""reading"": ""いく"", ""meaning"": ""to go"", ""contribution"": ""Verb""}, {""part"": ""ください"", ""reading"": ""ください"", ""meaning"": ""please"", ""contribution"": ""Polite request form""}, {""part"": ""くれる"", ""reading"": ""くれる"", ""meaning"": ""to give"", ""contribution"": ""Verb""}], ""combined_explanation"": """"}], ""grammar"": {""context"": ""This sentence is a polite way to instruct someone to move in a straight direction. It is commonly used in situations such as giving directions."", ""steps"": [""**まっすぐ** - Describes the manner of the action, meaning “straight.”"", ""**行って** - The te-form of the verb “行く,” which is used here to connect to the request."", ""**ください** - A polite way to make a request, asking someone to perform the action of going straight.""], ""sentence_pattern"": ""- [Adverb] + [Verb (te-form)] + [ください]\n- **Kanji**: まっすぐ行ってください。\n- **Hiragana**: まっすぐいってください。\n- **English Translation**: Please go straight."", ""sentence_pattern_kanji"": ""まっすぐ行ってください。"", ""sentence_pattern_hiragana"": ""まっすぐいってください。"", ""sentence_pattern_english"": ""Please go straight."", ""contribution"": """"}, ""tips"": {""tip"": ""Remember that the te-form of a verb is often used to make requests in Japanese. It connects the action to the polite request form \""ください,\"" making it a common structure for asking someone to do something."", ""common_mistake"": ""Beginners may forget to use the te-form when making requests. Ensure you conjugate the verb correctly to the te-form before adding \""ください.\"""", ""alternative_expression"": {""kanji"": ""まっすぐ行ってもらえますか？"", ""hiragana"": ""まっすぐいってもらえますか？"", ""english"": ""Could you please go straight?""}, ""new_words_in_alternative"": [{""word"": ""もらえますか"", ""reading"": ""もらえますか"", ""meaning"": ""could you receive"", ""description"": ""Polite request form""}]}}",Vocab,4,"straight (ahead), direct",,まっすぐ行ってください。,
N5,,,多い,おおい,I-adjective (keiyoushi),There are many apples.,"{""vocabulary"": [{""word"": ""りんご"", ""reading"": ""りんご"", ""meaning"": ""apple"", ""role"": ""Noun"", ""components"": [], ""combined_explanation"": """"}, {""word"": ""が"", ""reading"": ""が"", ""meaning"": ""[Subject Marker]"", ""role"": ""Particle"", ""components"": [], ""combined_explanation"": """"}, {""word"": ""多い"", ""reading"": ""おおい"", ""meaning"": ""many"", ""role"": ""Adjective"", ""components"": [{""part"": ""多"", ""reading"": ""おお"", ""meaning"": ""many"", ""contribution"": ""Adjective root""}], ""combined_explanation"": """"}, {""word"": ""です"", ""reading"": ""です"", ""meaning"": ""[Polite ending]"", ""role"": ""Copula"", ""components"": [], ""combined_explanation"": """"}], ""grammar"": {""context"": ""This sentence states that there is a large quantity of apples present. It can be used in various contexts, such as describing a fruit market or a garden."", ""steps"": [""**りんご** - Refers to the subject of the sentence, which is \""apples.\"""", ""**が** - Marks “りんご” as the subject of the sentence."", ""**多い** - The adjective that describes the quantity of the subject, meaning \""many.\"""", ""**です** - A polite ending that confirms the state of the subject.""], ""sentence_pattern"": ""- [Subject] + [が] + [Adjective] + [です]\n- **Kanji**: 猫が多いです。\n- **Hiragana**: ねこがおおいです。\n- **English Translation**: There are many cats."", ""sentence_pattern_kanji"": ""猫が多いです。"", ""sentence_pattern_hiragana"": ""ねこがおおいです。"", ""sentence_pattern_english"": ""There are many cats."", ""contribution"": """"}, ""tips"": {""tip"": ""Remember that が is used to mark the subject of the sentence, which is important for understanding what the sentence is about. In this case, it indicates that \""apples\"" are the subject being described."", ""common_mistake"": ""Beginners often confuse が with は. While は marks the topic of the sentence, が specifically identifies the subject. In this sentence, we are stating something about the apples, so が is appropriate."", ""alternative_expression"": {""kanji"": ""りんごがたくさんあります。"", ""hiragana"": ""りんごがたくさんあります。"", ""english"": ""There are a lot of apples.""}, ""new_words_in_alternative"": [{""word"": ""たくさん"", ""reading"": ""たくさん"", ""meaning"": ""a lot"", ""description"": ""Adverb""}, {""word"": ""あります"", ""reading"": ""あります"", ""meaning"": ""there is"", ""description"": ""Verb, polite form""}]}}",Vocab,4,many; there are a lot,,りんごが多いです。,
N5,,,まずい,まずい,I-adjective (keiyoushi),This dish is bad.,"{""vocabulary"": [{""word"": ""この"", ""reading"": ""この"", ""meaning"": ""this"", ""role"": ""Demonstrative adjective"", ""components"": [], ""combined_explanation"": "" **料理 (りょうり)**: “dish” or “cuisine” - [Noun]""}, {""word"": ""は"", ""reading"": ""は"", ""meaning"": ""[Topic Marker]"", ""role"": ""Particle"", ""components"": [], ""combined_explanation"": "" **まずい (まずい)**: “bad” (in taste) - [Adjective]""}, {""word"": ""です"", ""reading"": ""です"", ""meaning"": ""[Polite ending particle]"", ""role"": ""Copula"", ""components"": [], ""combined_explanation"": """"}], ""grammar"": {""context"": ""This sentence expresses the speaker's opinion about a particular dish, indicating that they find it unappetizing or of poor quality. It conveys a negative evaluation of the dish."", ""steps"": [""**この** - Specifies which dish is being referred to, indicating it is close to the speaker."", ""**料理** - The noun that represents the subject of the sentence, which is the dish."", ""**は** - Marks “料理” as the topic of the sentence."", ""**まずい** - The adjective that describes the dish, indicating it is bad in taste."", ""**です** - A polite ending that makes the statement more formal.""], ""sentence_pattern"": ""- [Demonstrative] + [Noun] + [は] + [Adjective] + [です]\n- **Kanji**: この料理はおいしいです。\n- **Hiragana**: このりょうりはおいしいです。\n- **English Translation**: This dish is delicious."", ""sentence_pattern_kanji"": ""この料理はおいしいです。"", ""sentence_pattern_hiragana"": ""このりょうりはおいしいです。"", ""sentence_pattern_english"": ""This dish is delicious."", ""contribution"": """"}, ""tips"": {""tip"": ""Remember that は marks the topic of the sentence, and the adjective describes that topic. In this case, the adjective “まずい” gives a negative evaluation of the dish."", ""common_mistake"": ""Beginners often confuse the use of です with other forms of verbs. Remember that です is used to make a statement polite, especially when describing nouns or adjectives."", ""alternative_expression"": {""kanji"": ""この料理は良くないです。"", ""hiragana"": ""このりょうりはよくないです。"", ""english"": ""This dish is not good.""}, ""new_words_in_alternative"": [{""word"": ""良くない"", ""reading"": ""よくない"", ""meaning"": ""not good"", ""description"": ""Adjective, negative form""}]}}",Vocab,4,"bad (in reference to food), unappetizing, unpleasant (taste)",,この料理はまずいです。,
N5,,,好き,すき,Na-adjective,I like apples.,"{""vocabulary"": [{""word"": ""私"", ""reading"": ""わたし"", ""meaning"": ""I"", ""role"": ""Pronoun"", ""components"": [], ""combined_explanation"": """"}, {""word"": ""は"", ""reading"": ""は"", ""meaning"": ""[Topic Marker]"", ""role"": ""Particle"", ""components"": [], ""combined_explanation"": """"}, {""word"": ""りんご"", ""reading"": ""りんご"", ""meaning"": ""apple"", ""role"": ""Noun"", ""components"": [], ""combined_explanation"": """"}, {""word"": ""が"", ""reading"": ""が"", ""meaning"": ""[Subject Marker]"", ""role"": ""Particle"", ""components"": [], ""combined_explanation"": """"}, {""word"": ""好き"", ""reading"": ""すき"", ""meaning"": ""like"", ""role"": ""Adjective"", ""components"": [], ""combined_explanation"": """"}, {""word"": ""です"", ""reading"": ""です"", ""meaning"": ""is"", ""role"": ""Copula"", ""components"": [], ""combined_explanation"": """"}], ""grammar"": {""context"": ""This sentence expresses the speaker's personal preference, indicating that they enjoy eating or having apples. It is a straightforward statement about liking something."", ""steps"": [""**私** - Refers to the speaker, “I.”"", ""**は** - Marks “私” as the topic of the sentence."", ""**りんご** - Indicates the object of the speaker's affection, “apple.”"", ""**が** - Marks “りんご” as the subject of the liking."", ""**好き** - An adjective that expresses the feeling of liking or preference."", ""**です** - A polite ending particle that adds formality to the sentence.""], ""sentence_pattern"": ""- [Topic] + [は] + [Subject] + [が] + [Adjective] + [です]\n- **Kanji**: 彼はサッカーが好きです。\n- **Hiragana**: かれはさっかーがすきです。\n- **English Translation**: He likes soccer."", ""sentence_pattern_kanji"": ""彼はサッカーが好きです。"", ""sentence_pattern_hiragana"": ""かれはさっかーがすきです。"", ""sentence_pattern_english"": ""He likes soccer."", ""contribution"": """"}, ""tips"": {""tip"": ""Remember that は marks the topic of the sentence, while が marks the subject of the liking. This distinction helps clarify what the sentence is about."", ""common_mistake"": ""Beginners often confuse the use of は and が. In this context, は is used to introduce the topic (the speaker), while が is used to indicate what the speaker likes (the apple)."", ""alternative_expression"": {""kanji"": ""私はりんごが好きだ。"", ""hiragana"": ""わたしはりんごがすきだ。"", ""english"": ""I like apples. (less formal)""}, ""new_words_in_alternative"": [{""word"": ""だ"", ""reading"": ""だ"", ""meaning"": ""is"", ""description"": ""Copula""}]}}",Vocab,4,"liking, fondness, love",,私はりんごが好きです。,
N5,,,財布,さいふ,Noun,I have a wallet.,"{""vocabulary"": [{""word"": ""私"", ""reading"": ""わたし"", ""meaning"": ""I"", ""role"": ""Pronoun"", ""components"": [], ""combined_explanation"": """"}, {""word"": ""は"", ""reading"": ""は"", ""meaning"": ""[Topic Marker]"", ""role"": ""Particle"", ""components"": [], ""combined_explanation"": """"}, {""word"": ""財布"", ""reading"": ""さいふ"", ""meaning"": ""wallet"", ""role"": ""Noun"", ""components"": [], ""combined_explanation"": """"}, {""word"": ""を"", ""reading"": ""を"", ""meaning"": ""[Object Marker]"", ""role"": ""Particle"", ""components"": [], ""combined_explanation"": """"}, {""word"": ""持っています"", ""reading"": ""もっています"", ""meaning"": ""have"", ""role"": ""Verb, present continuous"", ""components"": [], ""combined_explanation"": """"}], ""grammar"": {""context"": ""This sentence expresses that the speaker possesses a wallet. It indicates an ongoing state of having the wallet, rather than just a one-time action."", ""steps"": [""**私** - Refers to the speaker, “I.”"", ""**は** - Marks “私” as the topic of the sentence."", ""**財布** - The object being possessed, “wallet.”"", ""**を** - Marks “財布” as the direct object of the verb."", ""**持っています** - The present continuous form of “持つ,” indicating that the speaker currently has the wallet.""], ""sentence_pattern"": ""- [Topic] + [は] + [Object] + [を] + [Verb (present continuous)]\n- **Kanji**: 彼は本を読んでいます。\n- **Hiragana**: かれはほんをよんでいます。\n- **English Translation**: He is reading a book."", ""sentence_pattern_kanji"": ""彼は本を読んでいます。"", ""sentence_pattern_hiragana"": ""かれはほんをよんでいます。"", ""sentence_pattern_english"": ""He is reading a book."", ""contribution"": """"}, ""tips"": {""tip"": ""Remember that は marks the topic of the sentence, while を marks the object of the verb. This helps clarify who is doing the action and what is being acted upon."", ""common_mistake"": ""Beginners often confuse the use of を and は. Make sure to use を for the object of the verb and は for the topic of the sentence."", ""alternative_expression"": {""kanji"": ""私は財布を持っている。"", ""hiragana"": ""わたしはさいふをもっている。"", ""english"": ""I have a wallet.""}, ""new_words_in_alternative"": [{""word"": ""持っている"", ""reading"": ""もっている"", ""meaning"": ""have"", ""description"": ""Verb, present continuous""}]}}",Vocab,4,a small bag used to carry money and cards,,私は財布を持っています。,
N5,,,遅い,おそい,I-adjective (keiyoushi),He is slow.,"{""vocabulary"": [{""word"": ""彼"", ""reading"": ""かれ"", ""meaning"": ""he"", ""role"": ""Pronoun"", ""components"": [], ""combined_explanation"": """"}, {""word"": ""は"", ""reading"": ""は"", ""meaning"": ""[Topic Marker]"", ""role"": ""Particle"", ""components"": [], ""combined_explanation"": """"}, {""word"": ""遅い"", ""reading"": ""おそい"", ""meaning"": ""slow"", ""role"": ""Adjective"", ""components"": [], ""combined_explanation"": """"}, {""word"": ""です"", ""reading"": ""です"", ""meaning"": ""[Polite ending particle]"", ""role"": ""Copula"", ""components"": [], ""combined_explanation"": """"}], ""grammar"": {""context"": ""This sentence describes a characteristic of a male individual, stating that he is slow. It can refer to his speed in movement, thought, or action."", ""steps"": [""**彼** - Refers to the subject of the sentence, meaning \""he.\"""", ""**は** - Marks “彼” as the topic of the sentence."", ""**遅い** - An adjective that describes the subject, meaning \""slow.\"""", ""**です** - A polite ending particle that adds formality to the statement.""], ""sentence_pattern"": ""- [Topic] + [は] + [Adjective] + [です]\n- **Kanji**: 彼は優しいです。\n- **Hiragana**: かれはやさしいです。\n- **English Translation**: He is kind."", ""sentence_pattern_kanji"": ""彼は優しいです。"", ""sentence_pattern_hiragana"": ""かれはやさしいです。"", ""sentence_pattern_english"": ""He is kind."", ""contribution"": """"}, ""tips"": {""tip"": ""Remember that は marks the topic of the sentence, which is often the subject, but it can also indicate what the sentence is about. In this case, it emphasizes that \""he\"" is the focus."", ""common_mistake"": ""Beginners sometimes confuse the use of です with other forms of \""to be.\"" Remember that です is used in polite contexts and is not a verb in the same way as \""is\"" in English."", ""alternative_expression"": {""kanji"": ""彼は遅いと思います。"", ""hiragana"": ""かれはおそいとおもいます。"", ""english"": ""I think he is slow.""}, ""new_words_in_alternative"": [{""word"": ""と思います"", ""reading"": ""とおもいます"", ""meaning"": ""I think"", ""description"": ""Phrase""}]}}",Vocab,4,slow; late,,彼は遅いです。,
N5,,,明るい,あかるい,I-adjective (keiyoushi),She has a bright personality.,"{""vocabulary"": [{""word"": ""彼女"", ""reading"": ""かのじ"", ""meaning"": ""she"", ""role"": ""Pronoun"", ""components"": [], ""combined_explanation"": """"}, {""word"": ""は"", ""reading"": ""は"", ""meaning"": ""[Topic Marker]"", ""role"": ""Particle"", ""components"": [], ""combined_explanation"": """"}, {""word"": ""明るい"", ""reading"": ""あかるい"", ""meaning"": ""bright"", ""role"": ""Adjective"", ""components"": [], ""combined_explanation"": """"}, {""word"": ""性格"", ""reading"": ""せいかく"", ""meaning"": ""personality"", ""role"": ""Noun"", ""components"": [], ""combined_explanation"": """"}, {""word"": ""です"", ""reading"": ""です"", ""meaning"": ""[Copula]"", ""role"": ""Particle"", ""components"": [], ""combined_explanation"": """"}], ""grammar"": {""context"": ""This sentence describes a characteristic of a female individual, stating that she possesses a cheerful or positive personality. It conveys a positive trait about her."", ""steps"": [""**彼女** - Refers to the subject of the sentence, meaning \""she.\"""", ""**は** - Marks “彼女” as the topic of the sentence."", ""**明るい** - An adjective that describes the personality as bright or cheerful."", ""**性格** - The noun that specifies what is being described (her personality)."", ""**です** - A copula that functions like \""is\"" in English, linking the subject to the description.""], ""sentence_pattern"": ""- [Topic] + [は] + [Adjective] + [Noun] + [です]\n- **Kanji**: 彼は優しい人です。\n- **Hiragana**: かれはやさしいひとです。\n- **English Translation**: He is a kind person."", ""sentence_pattern_kanji"": ""彼は優しい人です。"", ""sentence_pattern_hiragana"": ""かれはやさしいひとです。"", ""sentence_pattern_english"": ""He is a kind person."", ""contribution"": """"}, ""tips"": {""tip"": ""Remember that は marks the topic of the sentence, which is often the subject, but not always. It helps to focus on what the sentence is about."", ""common_mistake"": ""Beginners might confuse the use of です with other verbs. Remember that です is used to link the subject with a description or identity, similar to the verb \""to be\"" in English."", ""alternative_expression"": {""kanji"": ""彼女は明るい人です。"", ""hiragana"": ""かのじょはあかるいひとです。"", ""english"": ""She is a bright person.""}, ""new_words_in_alternative"": [{""word"": ""人"", ""reading"": ""ひと"", ""meaning"": ""person"", ""description"": ""Noun""}]}}",Vocab,4,bright; cheerful,,彼女は明るい性格です。,
