JLPT,Example Words,Onyomi,Word,Reading,Word Type,Example Sentence EN,breakdown,type,Lesson,Meaning,Kanji,Example Sentence JP,Kunyomi
N5,,,に,に,Particle,I will go to school.,"{""vocabulary"": [{""word"": ""学校"", ""reading"": ""がっこう"", ""meaning"": ""school"", ""role"": ""Noun"", ""components"": [], ""combined_explanation"": """"}, {""word"": ""に"", ""reading"": ""に"", ""meaning"": ""[Direction/Location Marker]"", ""role"": ""Particle"", ""components"": [], ""combined_explanation"": """"}, {""word"": ""行きます"", ""reading"": ""いきます"", ""meaning"": ""will go"", ""role"": ""Verb, non-past polite form"", ""components"": [{""part"": ""行く"", ""reading"": ""いく"", ""meaning"": ""to go"", ""contribution"": ""Verb""}], ""combined_explanation"": """"}], ""grammar"": {""context"": ""This sentence expresses the speaker's intention to go to school. It indicates a future action in a polite manner."", ""steps"": [""**学校** - Refers to the destination, which is \""school.\"""", ""**に** - Indicates the direction or destination of the action, meaning \""to.\"""", ""**行きます** - The polite form of the verb \""行く,\"" indicating the action of going in a future or non-past context.""], ""sentence_pattern"": ""- [Destination] + [に] + [Verb (polite form)]\n- **Kanji**: 彼は公園に行きます。\n- **Hiragana**: かれはこうえんにいきます。\n- **English Translation**: He will go to the park."", ""sentence_pattern_kanji"": ""彼は公園に行きます。"", ""sentence_pattern_hiragana"": ""かれはこうえんにいきます。"", ""sentence_pattern_english"": ""He will go to the park."", ""contribution"": """"}, ""tips"": {""tip"": ""Remember that に is used to indicate the direction or destination of an action. Think of it as \""to\"" when you are expressing where you are going."", ""common_mistake"": ""Beginners often confuse に with へ. While both can indicate direction, に is more specific for indicating a destination, while へ is more general and can imply direction without a specific endpoint."", ""alternative_expression"": {""kanji"": ""学校へ行きます。"", ""hiragana"": ""がっこうへいきます。"", ""english"": ""I will go to school.""}, ""new_words_in_alternative"": [{""word"": ""へ"", ""reading"": ""へ"", ""meaning"": ""[Direction Marker]"", ""description"": ""Particle""}]}}",Grammar,3,destination particle; indicates a location or direction,,学校に行きます。,
N5,,,にいく,にいく,Expression,I go to school.,"{""vocabulary"": [{""word"": ""私"", ""reading"": ""わたし"", ""meaning"": ""I"", ""role"": ""Pronoun"", ""components"": [], ""combined_explanation"": """"}, {""word"": ""は"", ""reading"": ""は"", ""meaning"": ""[Topic Marker]"", ""role"": ""Particle"", ""components"": [], ""combined_explanation"": """"}, {""word"": ""学校"", ""reading"": ""がっこう"", ""meaning"": ""school"", ""role"": ""Noun"", ""components"": [], ""combined_explanation"": """"}, {""word"": ""に"", ""reading"": ""に"", ""meaning"": ""[Direction/Location Marker]"", ""role"": ""Particle"", ""components"": [], ""combined_explanation"": """"}, {""word"": ""行く"", ""reading"": ""いく"", ""meaning"": ""to go"", ""role"": ""Verb, dictionary form"", ""components"": [], ""combined_explanation"": """"}], ""grammar"": {""context"": ""This sentence expresses a simple action where the speaker is stating their intention or habit of going to school. It is a straightforward declaration about the subject's action."", ""steps"": [""**私** - Refers to the speaker, “I.”"", ""**は** - Marks “私” as the topic of the sentence, indicating that the sentence is about the speaker."", ""**学校** - Indicates the destination, which is “school.”"", ""**に** - Indicates the direction or location of the action, meaning “to.”"", ""**行く** - The verb meaning “to go,” in its dictionary form, indicating the action being taken.""], ""sentence_pattern"": ""- [Topic] + [は] + [Destination] + [に] + [Verb]\n- **Kanji**: 彼は公園に行く。\n- **Hiragana**: かれはこうえんにいく。\n- **English Translation**: He goes to the park."", ""sentence_pattern_kanji"": ""彼は公園に行く。"", ""sentence_pattern_hiragana"": ""かれはこうえんにいく。"", ""sentence_pattern_english"": ""He goes to the park."", ""contribution"": """"}, ""tips"": {""tip"": ""Remember that は marks the topic of the sentence, which helps clarify who is performing the action. In this case, it is the speaker (私) going to school."", ""common_mistake"": ""Beginners often confuse に with へ. While both can indicate direction, に is used for specific locations, while へ is more general and indicates direction towards a goal."", ""alternative_expression"": {""kanji"": ""私は学校へ行く。"", ""hiragana"": ""わたしはがっこうへいく。"", ""english"": ""I go to school.""}, ""new_words_in_alternative"": [{""word"": ""へ"", ""reading"": ""へ"", ""meaning"": ""[Direction Marker]"", ""description"": ""Particle""}]}}",Grammar,3,to go to do (something),,私は学校に行く。,
N5,,,に/へ,に / へ,Particle,I will go to school.,"{""vocabulary"": [{""word"": ""学校"", ""reading"": ""がっこう"", ""meaning"": ""school"", ""role"": ""Noun"", ""components"": [], ""combined_explanation"": """"}, {""word"": ""に"", ""reading"": ""に"", ""meaning"": ""[Direction/Location Marker]"", ""role"": ""Particle"", ""components"": [], ""combined_explanation"": """"}, {""word"": ""行きます"", ""reading"": ""いきます"", ""meaning"": ""will go"", ""role"": ""Verb, polite form"", ""components"": [{""part"": ""行く"", ""reading"": ""いく"", ""meaning"": ""to go"", ""contribution"": ""Verb""}], ""combined_explanation"": """"}], ""grammar"": {""context"": ""This sentence expresses the speaker's intention to go to school. It indicates a future action in a polite manner, commonly used in everyday conversation."", ""steps"": [""**学校** - Refers to the destination, which is \""school.\"""", ""**に** - Indicates the direction or destination of the action, meaning \""to.\"""", ""**行きます** - The polite form of the verb \""to go,\"" indicating the action that will take place.""], ""sentence_pattern"": ""- [Destination] + [に] + [Verb (polite form)]\n- **Kanji**: 彼は公園に行きます。\n- **Hiragana**: かれはこうえんにいきます。\n- **English Translation**: He will go to the park."", ""sentence_pattern_kanji"": ""彼は公園に行きます。"", ""sentence_pattern_hiragana"": ""かれはこうえんにいきます。"", ""sentence_pattern_english"": ""He will go to the park."", ""contribution"": """"}, ""tips"": {""tip"": ""Remember that に is used to indicate the destination of the action. It helps to visualize where you are going when using verbs of movement."", ""common_mistake"": ""Beginners often confuse に with へ. While both can indicate direction, に is more specific for indicating a destination, whereas へ is more general."", ""alternative_expression"": {""kanji"": ""学校へ行きます。"", ""hiragana"": ""がっこうへいきます。"", ""english"": ""I will go to school.""}, ""new_words_in_alternative"": [{""word"": ""へ"", ""reading"": ""へ"", ""meaning"": ""[Direction Marker]"", ""description"": ""Particle""}]}}",Grammar,3,to (indicates direction or destination),,学校に行きます。,
N5,,,を,を,Particle,I will eat an apple.,"{""vocabulary"": [{""word"": ""りんご"", ""reading"": ""りんご"", ""meaning"": ""apple"", ""role"": ""Noun"", ""components"": [], ""combined_explanation"": """"}, {""word"": ""を"", ""reading"": ""を"", ""meaning"": ""[Object Marker]"", ""role"": ""Particle"", ""components"": [], ""combined_explanation"": """"}, {""word"": ""たべます"", ""reading"": ""たべます"", ""meaning"": ""will eat"", ""role"": ""Verb, non-past polite form"", ""components"": [{""part"": ""たべる"", ""reading"": ""たべる"", ""meaning"": ""to eat"", ""contribution"": ""Verb""}], ""combined_explanation"": """"}], ""grammar"": {""context"": ""This sentence expresses the speaker's intention to eat an apple in a polite manner. It indicates a future action using the non-past tense."", ""steps"": [""**りんご** - Refers to the object of the action, which is the apple."", ""**を** - Marks “りんご” as the direct object of the verb."", ""**たべます** - The polite form of the verb “たべる,” indicating the action of eating in a respectful way.""], ""sentence_pattern"": ""- [Object] + [を] + [Verb (polite form)]\n- **Kanji**: パンを食べます。\n- **Hiragana**: ぱんをたべます。\n- **English Translation**: I will eat bread."", ""sentence_pattern_kanji"": ""パンを食べます。"", ""sentence_pattern_hiragana"": ""ぱんをたべます。"", ""sentence_pattern_english"": ""I will eat bread."", ""contribution"": """"}, ""tips"": {""tip"": ""Remember that を is used to mark the direct object of the verb. This is crucial for understanding what is being acted upon in the sentence."", ""common_mistake"": ""Beginners often confuse を with は. While は marks the topic of the sentence, を specifically indicates the object of the action."", ""alternative_expression"": {""kanji"": ""りんごを食べる。"", ""hiragana"": ""りんごをたべる。"", ""english"": ""I eat an apple.""}, ""new_words_in_alternative"": [{""word"": ""食べる"", ""reading"": ""たべる"", ""meaning"": ""to eat"", ""description"": ""Verb""}]}}",Grammar,3,particle used to indicate the direct object of a verb,,りんごをたべます。,
N5,銀行(ぎんこう): bank; 行く(いく): to go; 旅行(りょこう): travel,こう,,,,,,Kanji,3,go/execute,行,,い
N5,来る(くる): to come; 来月(らいげつ): next month; 来年(らいねん): next year,らい,,,,,,Kanji,3,come/next,来,,くる
