JLPT,Example Words,Onyomi,Word,Reading,Word Type,Example Sentence EN,breakdown,type,Lesson,Meaning,Kanji,Example Sentence JP,Kunyomi
N5,,,重い,おもい,I-adjective (keiyoushi),This luggage is heavy.,"{""vocabulary"": [{""word"": ""この"", ""reading"": ""この"", ""meaning"": ""this"", ""role"": ""Demonstrative adjective"", ""components"": [], ""combined_explanation"": """"}, {""word"": ""荷物"", ""reading"": ""にもつ"", ""meaning"": ""luggage"", ""role"": ""Noun"", ""components"": [], ""combined_explanation"": """"}, {""word"": ""は"", ""reading"": ""は"", ""meaning"": ""[Topic Marker]"", ""role"": ""Particle"", ""components"": [], ""combined_explanation"": """"}, {""word"": ""重い"", ""reading"": ""おもい"", ""meaning"": ""heavy"", ""role"": ""Adjective"", ""components"": [], ""combined_explanation"": """"}, {""word"": ""です"", ""reading"": ""です"", ""meaning"": ""is"", ""role"": ""Copula"", ""components"": [], ""combined_explanation"": """"}], ""grammar"": {""context"": ""This sentence describes a specific piece of luggage, indicating its weight. It is a straightforward statement about the luggage being heavy."", ""steps"": [""**この** - Specifies which luggage is being referred to, indicating it is close to the speaker."", ""**荷物** - The subject of the sentence, meaning \""luggage.\"""", ""**は** - Marks “荷物” as the topic of the sentence."", ""**重い** - Describes the state of the luggage, indicating that it is heavy."", ""**です** - A polite ending that functions as the verb \""to be,\"" affirming the statement.""], ""sentence_pattern"": ""- [Demonstrative] + [Noun] + [は] + [Adjective] + [です]\n- **Kanji**: その本は面白いです。\n- **Hiragana**: そのほんはおもしろいです。\n- **English Translation**: That book is interesting."", ""sentence_pattern_kanji"": ""その本は面白いです。"", ""sentence_pattern_hiragana"": ""そのほんはおもしろいです。"", ""sentence_pattern_english"": ""That book is interesting."", ""contribution"": """"}, ""tips"": {""tip"": ""Remember that この is used for things that are close to you, while その is used for things that are not close. This helps in distinguishing between different demonstratives."", ""common_mistake"": ""Beginners often confuse the use of は and が. In this context, は is used to mark the topic (the luggage), while が is typically used to emphasize the subject of a sentence."", ""alternative_expression"": {""kanji"": ""この荷物は重たいです。"", ""hiragana"": ""このにもつはおもたいです。"", ""english"": ""This luggage is heavy.""}, ""new_words_in_alternative"": [{""word"": ""重たい"", ""reading"": ""おもたい"", ""meaning"": ""heavy"", ""description"": ""Adjective""}]}}",Vocab,10,heavy; serious,,この荷物は重いです。,
N5,,,長い,ながい,I-adjective (keiyoushi),This road is long.,"{""vocabulary"": [{""word"": ""この"", ""reading"": ""この"", ""meaning"": ""this"", ""role"": ""Demonstrative adjective"", ""components"": [], ""combined_explanation"": """"}, {""word"": ""道"", ""reading"": ""みち"", ""meaning"": ""road"", ""role"": ""Noun"", ""components"": [], ""combined_explanation"": """"}, {""word"": ""は"", ""reading"": ""は"", ""meaning"": ""[Topic Marker]"", ""role"": ""Particle"", ""components"": [], ""combined_explanation"": """"}, {""word"": ""長い"", ""reading"": ""ながい"", ""meaning"": ""long"", ""role"": ""Adjective"", ""components"": [], ""combined_explanation"": """"}, {""word"": ""です"", ""reading"": ""です"", ""meaning"": ""is"", ""role"": ""Copula"", ""components"": [], ""combined_explanation"": """"}], ""grammar"": {""context"": ""This sentence describes a specific road, indicating its length. It provides a straightforward observation about the road being long."", ""steps"": [""**この** - Specifies which road is being referred to, indicating proximity (this road)."", ""**道** - The noun that is the subject of the sentence, meaning “road.”"", ""**は** - Marks “道” as the topic of the sentence."", ""**長い** - The adjective that describes the noun, indicating its length."", ""**です** - A polite ending that functions as the copula, linking the subject and the adjective.""], ""sentence_pattern"": ""- [Demonstrative] + [Noun] + [は] + [Adjective] + [です]\n- **Kanji**: その道は短いです。\n- **Hiragana**: そのみちはみじかいです。\n- **English Translation**: That road is short."", ""sentence_pattern_kanji"": ""その道は短いです。"", ""sentence_pattern_hiragana"": ""そのみちはみじかいです。"", ""sentence_pattern_english"": ""That road is short."", ""contribution"": """"}, ""tips"": {""tip"": ""Remember that は marks the topic of the sentence, which helps to clarify what you are talking about. In this case, it emphasizes \""this road.\"""", ""common_mistake"": ""Beginners often confuse the use of です with other verbs. Remember that です is used to link the subject with a description or state of being, especially in polite speech."", ""alternative_expression"": {""kanji"": ""この道は長い。"", ""hiragana"": ""このみちはながい。"", ""english"": ""This road is long. (less formal)""}, ""new_words_in_alternative"": [{""word"": ""長い"", ""reading"": ""ながい"", ""meaning"": ""long"", ""description"": ""Adjective""}]}}",Vocab,10,"long, lengthy",,この道は長いです。,
N5,,,春,はる,Noun,Spring has come.,"{""vocabulary"": [{""word"": ""春"", ""reading"": ""はる"", ""meaning"": ""spring"", ""role"": ""Noun"", ""components"": [], ""combined_explanation"": """"}, {""word"": ""が"", ""reading"": ""が"", ""meaning"": ""[Subject Marker]"", ""role"": ""Particle"", ""components"": [], ""combined_explanation"": """"}, {""word"": ""来ました"", ""reading"": ""きました"", ""meaning"": ""has come"", ""role"": ""Verb, past tense"", ""components"": [{""part"": ""来る"", ""reading"": ""くる"", ""meaning"": ""to come"", ""contribution"": ""Verb""}], ""combined_explanation"": """"}], ""grammar"": {""context"": ""This sentence announces the arrival of spring, indicating a change in season. It conveys a sense of renewal and the transition from winter to spring."", ""steps"": [""**春** - Refers to the season of spring."", ""**が** - Marks “春” as the subject of the sentence."", ""**来ました** - The past tense of “来る,” indicating that the action of coming has been completed.""], ""sentence_pattern"": ""- [Subject] + [が] + [Verb (past tense)]\n- **Kanji**: 雨が降りました。\n- **Hiragana**: あめがふりました。\n- **English Translation**: It rained."", ""sentence_pattern_kanji"": ""雨が降りました。"", ""sentence_pattern_hiragana"": ""あめがふりました。"", ""sentence_pattern_english"": ""It rained."", ""contribution"": """"}, ""tips"": {""tip"": ""Remember that が marks the subject of the sentence, which is important for understanding who or what is performing the action. In this case, spring is the subject that has come."", ""common_mistake"": ""Beginners might confuse が with は. While が is used to mark the subject, は is used to mark the topic of the sentence. In this case, we focus on the subject (spring) rather than the topic."", ""alternative_expression"": {""kanji"": ""春がやってきました。"", ""hiragana"": ""はるがやってきました。"", ""english"": ""Spring has arrived.""}, ""new_words_in_alternative"": [{""word"": ""やってきました"", ""reading"": ""やってきました"", ""meaning"": ""has arrived"", ""description"": ""Verb, past tense""}]}}",Vocab,10,spring,,春が来ました。,
N5,,,シャワー,シャワー,Noun,I take a shower every morning.,"{""vocabulary"": [{""word"": ""毎朝"", ""reading"": ""まいあさ"", ""meaning"": ""every morning"", ""role"": ""Noun phrase"", ""components"": [{""part"": ""毎"", ""reading"": ""まい"", ""meaning"": ""every"", ""contribution"": ""Adverb""}, {""part"": ""朝"", ""reading"": ""あさ"", ""meaning"": ""morning"", ""contribution"": ""Noun""}], ""combined_explanation"": """"}, {""word"": ""シャワー"", ""reading"": ""しゃわー"", ""meaning"": ""shower"", ""role"": ""Noun"", ""components"": [], ""combined_explanation"": """"}, {""word"": ""を"", ""reading"": ""を"", ""meaning"": ""[Object Marker]"", ""role"": ""Particle"", ""components"": [], ""combined_explanation"": """"}, {""word"": ""浴びます"", ""reading"": ""あびます"", ""meaning"": ""take (a shower)"", ""role"": ""Verb, polite form"", ""components"": [], ""combined_explanation"": """"}], ""grammar"": {""context"": ""This sentence describes a daily routine where the speaker takes a shower every morning. It emphasizes the habitual nature of the action."", ""steps"": [""**毎朝** - Indicates the time frame, meaning “every morning.”"", ""**シャワー** - Specifies the object of the action, which is “shower.”"", ""**を** - Marks “シャワー” as the direct object of the verb."", ""**浴びます** - The polite form of the verb “浴びる,” indicating the action of taking a shower.""], ""sentence_pattern"": ""- [Time Phrase] + [Object] + [を] + [Verb (polite form)]\n- **Kanji**: 毎朝お風呂に入ります。\n- **Hiragana**: まいあさおふろにはいります。\n- **English Translation**: I take a bath every morning."", ""sentence_pattern_kanji"": ""毎朝お風呂に入ります。"", ""sentence_pattern_hiragana"": ""まいあさおふろにはいります。"", ""sentence_pattern_english"": ""I take a bath every morning."", ""contribution"": """"}, ""tips"": {""tip"": ""Remember that 毎朝 sets the time for the action, while を indicates what you are taking action on (in this case, the shower). This structure helps clarify the routine nature of the sentence."", ""common_mistake"": ""Beginners might confuse the use of を with は. Remember that を is used for the direct object of the verb, while は marks the topic of the sentence."", ""alternative_expression"": {""kanji"": ""毎朝お風呂を浴びます。"", ""hiragana"": ""まいあさおふろをあびます。"", ""english"": ""I take a bath every morning.""}, ""new_words_in_alternative"": [{""word"": ""お風呂"", ""reading"": ""おふろ"", ""meaning"": ""bath"", ""description"": ""Noun""}]}}",Vocab,10,shower,,毎朝シャワーを浴びます。,
N5,,,雨,あめ,Noun,It is raining today.,"{""vocabulary"": [{""word"": ""今日"", ""reading"": ""きょう"", ""meaning"": ""today"", ""role"": ""Noun"", ""components"": [], ""combined_explanation"": """"}, {""word"": ""は"", ""reading"": ""は"", ""meaning"": ""[Topic Marker]"", ""role"": ""Particle"", ""components"": [], ""combined_explanation"": """"}, {""word"": ""雨"", ""reading"": ""あめ"", ""meaning"": ""rain"", ""role"": ""Noun"", ""components"": [], ""combined_explanation"": """"}, {""word"": ""が"", ""reading"": ""が"", ""meaning"": ""[Subject Marker]"", ""role"": ""Particle"", ""components"": [], ""combined_explanation"": """"}, {""word"": ""降っています"", ""reading"": ""ふっています"", ""meaning"": ""is raining"", ""role"": ""Verb, present continuous"", ""components"": [], ""combined_explanation"": """"}], ""grammar"": {""context"": ""This sentence describes the current weather condition, specifically that it is raining at the present moment. It provides information about the weather for today."", ""steps"": [""**今日** - Refers to the time frame, meaning \""today.\"""", ""**は** - Marks \""今日\"" as the topic of the sentence."", ""**雨** - Indicates what is happening, which is \""rain.\"""", ""**が** - Marks \""雨\"" as the subject of the action."", ""**降っています** - The present continuous form of \""降る,\"" indicating that the action of raining is ongoing.""], ""sentence_pattern"": ""- [Time] + [は] + [Subject] + [が] + [Verb (present continuous)]\n- **Kanji**: 明日は雪が降っています。\n- **Hiragana**: あしたはゆきがふっています。\n- **English Translation**: It is snowing tomorrow."", ""sentence_pattern_kanji"": ""明日は雪が降っています。"", ""sentence_pattern_hiragana"": ""あしたはゆきがふっています。"", ""sentence_pattern_english"": ""It is snowing tomorrow."", ""contribution"": """"}, ""tips"": {""tip"": ""Remember that は marks the topic of the sentence, which helps to focus on what the sentence is about. In this case, it highlights that the topic is \""today.\"""", ""common_mistake"": ""Beginners often confuse が and は. Use が to mark the subject of the action (the rain), while は is used to indicate the topic of the sentence (today)."", ""alternative_expression"": {""kanji"": ""今日は雨が降っている。"", ""hiragana"": ""きょうはあめがふっている。"", ""english"": ""It is raining today.""}, ""new_words_in_alternative"": [{""word"": ""降っている"", ""reading"": ""ふっている"", ""meaning"": ""is falling"", ""description"": ""Verb, present continuous""}]}}",Vocab,10,rain,,今日は雨が降っています。,
N5,,,コート,コート,Noun,I will wear my new coat today.,"{""vocabulary"": [{""word"": ""今日"", ""reading"": ""きょう"", ""meaning"": ""today"", ""role"": ""Noun"", ""components"": [], ""combined_explanation"": """"}, {""word"": ""は"", ""reading"": ""は"", ""meaning"": ""[Topic Marker]"", ""role"": ""Particle"", ""components"": [], ""combined_explanation"": """"}, {""word"": ""新しい"", ""reading"": ""あたらしい"", ""meaning"": ""new"", ""role"": ""Adjective"", ""components"": [], ""combined_explanation"": """"}, {""word"": ""コート"", ""reading"": ""こーと"", ""meaning"": ""coat"", ""role"": ""Noun"", ""components"": [], ""combined_explanation"": """"}, {""word"": ""を"", ""reading"": ""を"", ""meaning"": ""[Object Marker]"", ""role"": ""Particle"", ""components"": [], ""combined_explanation"": """"}, {""word"": ""着て"", ""reading"": ""きて"", ""meaning"": ""wearing"", ""role"": ""Verb, te-form"", ""components"": [{""part"": ""着る"", ""reading"": ""きる"", ""meaning"": ""to wear"", ""contribution"": ""Verb""}, {""part"": ""行きます"", ""reading"": ""いきます"", ""meaning"": ""will go"", ""contribution"": ""Verb, polite form""}, {""part"": ""行く"", ""reading"": ""いく"", ""meaning"": ""to go"", ""contribution"": ""Verb""}], ""combined_explanation"": """"}], ""grammar"": {""context"": ""This sentence conveys the speaker's intention to wear a new coat on the current day. It combines the action of wearing with the future intention of going somewhere."", ""steps"": [""**今日** - Refers to the current day, marking the time of the action."", ""**は** - Marks “今日” as the topic of the sentence."", ""**新しい** - Describes the coat as being new."", ""**コート** - The object being worn."", ""**を** - Marks “コート” as the direct object of the verb."", ""**着て** - The te-form of “着る,” indicating the action of wearing."", ""**行きます** - The polite future form of “行く,” indicating the intention to go somewhere after wearing the coat.""], ""sentence_pattern"": ""- [Time] + [は] + [Adjective] + [Noun] + [を] + [Verb (te-form)] + [Verb (polite form)]\n- **Kanji**: 明日は新しい靴を履いて行きます。\n- **Hiragana**: あしたはあたらしいくつをはいていきます。\n- **English Translation**: I will wear my new shoes tomorrow."", ""sentence_pattern_kanji"": ""明日は新しい靴を履いて行きます。"", ""sentence_pattern_hiragana"": ""あしたはあたらしいくつをはいていきます。"", ""sentence_pattern_english"": ""I will wear my new shoes tomorrow."", ""contribution"": """"}, ""tips"": {""tip"": ""Remember that the te-form (着て) is used to connect actions, allowing you to express multiple actions in one sentence. Here, it connects the action of wearing with the action of going."", ""common_mistake"": ""Beginners often confuse the use of を and は. Remember that を marks the direct object of the verb (the coat being worn), while は marks the topic of the sentence (today)."", ""alternative_expression"": {""kanji"": ""今日は新しいコートを着ます。"", ""hiragana"": ""きょうはあたらしいこーとをきます。"", ""english"": ""I will wear my new coat today.""}, ""new_words_in_alternative"": [{""word"": ""着ます"", ""reading"": ""きます"", ""meaning"": ""will wear"", ""description"": ""Verb, polite form""}]}}",Vocab,10,コートは、外で着る服の一種です。また、テニスなどのスポーツをする場所を指すこともあります。,,今日は新しいコートを着て行きます。,
N5,小さい(ちいさい): small; 小学校(しょうがっこう): elementary school; 小学生(しょうがくせい): elementary student,しょう,,,,,,Kanji,10,small,小,,ちい
N5,,,丁度,ちょうど,Adverb (fukushi),I am just having lunch now.,"{""vocabulary"": [{""word"": ""今"", ""reading"": ""いま"", ""meaning"": ""now"", ""role"": ""Adverb"", ""components"": [], ""combined_explanation"": """"}, {""word"": ""丁度"", ""reading"": ""ちょうど"", ""meaning"": ""just"", ""role"": ""Adverb"", ""components"": [], ""combined_explanation"": """"}, {""word"": ""お昼ご飯"", ""reading"": ""おひるごはん"", ""meaning"": ""lunch"", ""role"": ""Noun"", ""components"": [], ""combined_explanation"": """"}, {""word"": ""を"", ""reading"": ""を"", ""meaning"": ""[Object Marker]"", ""role"": ""Particle"", ""components"": [], ""combined_explanation"": """"}, {""word"": ""食べています"", ""reading"": ""たべています"", ""meaning"": ""am eating"", ""role"": ""Verb, present continuous"", ""components"": [{""part"": ""食べる"", ""reading"": ""たべる"", ""meaning"": ""to eat"", ""contribution"": ""Verb""}], ""combined_explanation"": """"}], ""grammar"": {""context"": ""This sentence describes the speaker's current activity of eating lunch. It emphasizes that this action is happening at the present moment."", ""steps"": [""**今** - Indicates the current time, meaning “now.”"", ""**丁度** - Adds emphasis, meaning “just” or “exactly.”"", ""**お昼ご飯** - Refers to the meal being eaten, specifically “lunch.”"", ""**を** - Marks “お昼ご飯” as the object of the verb."", ""**食べています** - The present continuous form of “食べる,” indicating that the action of eating is currently taking place.""], ""sentence_pattern"": ""- [Time] + [Adverb] + [Object] + [を] + [Verb (present continuous)]\n- **Kanji**: 彼は今、宿題をしています。\n- **Hiragana**: かれはいま、しゅくだいをしています。\n- **English Translation**: He is doing homework now."", ""sentence_pattern_kanji"": ""彼は今、宿題をしています。"", ""sentence_pattern_hiragana"": ""かれはいま、しゅくだいをしています。"", ""sentence_pattern_english"": ""He is doing homework now."", ""contribution"": """"}, ""tips"": {""tip"": ""Remember that the present continuous form (食べています) is used to describe actions happening right now. Pairing it with time indicators like 今 helps clarify when the action is taking place."", ""common_mistake"": ""Beginners often confuse the use of を and は. In this context, を is used to mark the direct object of the verb (the meal being eaten), while は would indicate the topic of the sentence."", ""alternative_expression"": {""kanji"": ""今、ちょうど昼食を食べています。"", ""hiragana"": ""いま、ちょうどちゅうしょくをたべています。"", ""english"": ""I am just having lunch now.""}, ""new_words_in_alternative"": [{""word"": ""昼食"", ""reading"": ""ちゅうしょく"", ""meaning"": ""lunch"", ""description"": ""Noun""}]}}",Vocab,10,"just, right, exactly",,今、丁度お昼ご飯を食べています。,
N5,,,寒い,さむい,I-adjective (keiyoushi),It is cold today.,"{""vocabulary"": [{""word"": ""今日"", ""reading"": ""きょう"", ""meaning"": ""today"", ""role"": ""Noun"", ""components"": [], ""combined_explanation"": """"}, {""word"": ""は"", ""reading"": ""は"", ""meaning"": ""[Topic Marker]"", ""role"": ""Particle"", ""components"": [], ""combined_explanation"": """"}, {""word"": ""寒い"", ""reading"": ""さむい"", ""meaning"": ""cold"", ""role"": ""Adjective, i-adjective"", ""components"": [], ""combined_explanation"": """"}, {""word"": ""です"", ""reading"": ""です"", ""meaning"": ""is"", ""role"": ""Copula"", ""components"": [], ""combined_explanation"": """"}], ""grammar"": {""context"": ""This sentence describes the weather condition of being cold on the current day. It is a straightforward statement about the temperature."", ""steps"": [""**今日** - Refers to the current day, marking the time reference."", ""**は** - Marks “今日” as the topic of the sentence."", ""**寒い** - An i-adjective that describes the state of being cold."", ""**です** - A polite ending particle that functions as the copula, linking the subject to the predicate.""], ""sentence_pattern"": ""- [Topic] + [は] + [Adjective] + [です]\n- **Kanji**: 明日は暑いです。\n- **Hiragana**: あしたはあついです。\n- **English Translation**: It will be hot tomorrow."", ""sentence_pattern_kanji"": ""明日は暑いです。"", ""sentence_pattern_hiragana"": ""あしたはあついです。"", ""sentence_pattern_english"": ""It will be hot tomorrow."", ""contribution"": """"}, ""tips"": {""tip"": ""Remember that は marks the topic of the sentence, which is often the subject, but not always. It helps to focus on what the sentence is about."", ""common_mistake"": ""Beginners might confuse the use of です with other forms of the verb “to be.” In Japanese, です is used for polite statements, while other forms may be used in casual speech."", ""alternative_expression"": {""kanji"": ""今日は冷たいです。"", ""hiragana"": ""きょうはつめたいです。"", ""english"": ""It is chilly today.""}, ""new_words_in_alternative"": [{""word"": ""冷たい"", ""reading"": ""つめたい"", ""meaning"": ""chilly"", ""description"": ""Adjective, i-adjective""}]}}",Vocab,10,cold (in reference to weather),,今日は寒いです。,
N5,,,薄い,うすい,I-adjective (keiyoushi),This book is thin.,"{""vocabulary"": [{""word"": ""この"", ""reading"": ""この"", ""meaning"": ""this"", ""role"": ""Demonstrative adjective"", ""components"": [], ""combined_explanation"": """"}, {""word"": ""本"", ""reading"": ""ほん"", ""meaning"": ""book"", ""role"": ""Noun"", ""components"": [], ""combined_explanation"": """"}, {""word"": ""は"", ""reading"": ""は"", ""meaning"": ""[Topic Marker]"", ""role"": ""Particle"", ""components"": [], ""combined_explanation"": """"}, {""word"": ""薄い"", ""reading"": ""うすい"", ""meaning"": ""thin"", ""role"": ""Adjective, i-adjective"", ""components"": [], ""combined_explanation"": """"}, {""word"": ""です"", ""reading"": ""です"", ""meaning"": ""is"", ""role"": ""Copula"", ""components"": [], ""combined_explanation"": """"}], ""grammar"": {""context"": ""This sentence describes a specific book, indicating its physical characteristic of being thin. It presents a simple statement about the book's quality."", ""steps"": [""**この** - Specifies which book is being referred to, indicating proximity (this book)."", ""**本** - The subject of the sentence, which is the book."", ""**は** - Marks “本” as the topic of the sentence."", ""**薄い** - Describes the quality of the book, indicating that it is thin."", ""**です** - A polite ending particle that confirms the statement.""], ""sentence_pattern"": ""- [Demonstrative] + [Noun] + [は] + [Adjective] + [です]\n- **Kanji**: そのペンは青いです。\n- **Hiragana**: そのぺんはあおいです。\n- **English Translation**: That pen is blue."", ""sentence_pattern_kanji"": ""そのペンは青いです。"", ""sentence_pattern_hiragana"": ""そのぺんはあおいです。"", ""sentence_pattern_english"": ""That pen is blue."", ""contribution"": """"}, ""tips"": {""tip"": ""Remember that は marks the topic of the sentence, which helps to focus on what you are describing. In this case, it is the book that is being described as thin."", ""common_mistake"": ""Beginners often confuse です with other forms of the verb \""to be.\"" Remember that です is used in polite contexts and is often used at the end of sentences."", ""alternative_expression"": {""kanji"": ""この本は細いです。"", ""hiragana"": ""このほんはほそいです。"", ""english"": ""This book is slender.""}, ""new_words_in_alternative"": [{""word"": ""細い"", ""reading"": ""ほそい"", ""meaning"": ""slender"", ""description"": ""Adjective, i-adjective""}]}}",Vocab,10,"thin, weak",,この本は薄いです。,
