JLPT,Example Words,Onyomi,Word,Reading,Word Type,Example Sentence EN,breakdown,type,Lesson,Meaning,Kanji,Example Sentence JP,Kunyomi
N5,,,近く,ちかく,Noun,There is a park near my house.,"{""vocabulary"": [{""word"": ""私"", ""reading"": ""わたし"", ""meaning"": ""I"", ""role"": ""Pronoun"", ""components"": [], ""combined_explanation"": """"}, {""word"": ""の"", ""reading"": ""の"", ""meaning"": ""[Possessive particle]"", ""role"": ""Particle"", ""components"": [], ""combined_explanation"": """"}, {""word"": ""家"", ""reading"": ""いえ"", ""meaning"": ""house"", ""role"": ""Noun"", ""components"": [], ""combined_explanation"": """"}, {""word"": ""の"", ""reading"": ""の"", ""meaning"": ""[Possessive particle]"", ""role"": ""Particle"", ""components"": [], ""combined_explanation"": """"}, {""word"": ""近く"", ""reading"": ""ちかく"", ""meaning"": ""near"", ""role"": ""Noun/Adverb"", ""components"": [], ""combined_explanation"": """"}, {""word"": ""に"", ""reading"": ""に"", ""meaning"": ""[Location marker]"", ""role"": ""Particle"", ""components"": [], ""combined_explanation"": """"}, {""word"": ""公園"", ""reading"": ""こうえん"", ""meaning"": ""park"", ""role"": ""Noun"", ""components"": [], ""combined_explanation"": """"}, {""word"": ""が"", ""reading"": ""が"", ""meaning"": ""[Subject marker]"", ""role"": ""Particle"", ""components"": [], ""combined_explanation"": """"}, {""word"": ""あります"", ""reading"": ""あります"", ""meaning"": ""there is"", ""role"": ""Verb, non-past"", ""components"": [], ""combined_explanation"": """"}], ""grammar"": {""context"": ""This sentence describes the existence of a park in relation to the speaker's house. It indicates the location of the park as being nearby."", ""steps"": [""**私の** - “my” indicates possession of the house."", ""**家の** - “house” is the noun being possessed."", ""**近くに** - “near” indicates the location where the park exists."", ""**公園** - Refers to the subject of the sentence, the park."", ""**が** - Marks “公園” as the subject of the sentence."", ""**あります** - Indicates that the park exists in that location.""], ""sentence_pattern"": ""- [Possessor] + [の] + [Noun] + [の] + [Location] + [に] + [Subject] + [が] + [Verb]\n- **Kanji**: 彼の家の近くに店があります。\n- **Hiragana**: かれのいえのちかくにみせがあります。\n- **English Translation**: There is a shop near his house."", ""sentence_pattern_kanji"": ""彼の家の近くに店があります。"", ""sentence_pattern_hiragana"": ""かれのいえのちかくにみせがあります。"", ""sentence_pattern_english"": ""There is a shop near his house."", ""contribution"": """"}, ""tips"": {""tip"": ""Remember that の is used to indicate possession, linking nouns together. In this case, it connects \""my\"" and \""house,\"" as well as \""house\"" and \""near.\"""", ""common_mistake"": ""Beginners often confuse に and へ. Remember that に indicates a specific location where something exists, while へ indicates direction towards a place."", ""alternative_expression"": {""kanji"": ""私の家のそばに公園があります。"", ""hiragana"": ""わたしのいえのそばにこうえんがあります。"", ""english"": ""There is a park beside my house.""}, ""new_words_in_alternative"": [{""word"": ""そば"", ""reading"": ""そば"", ""meaning"": ""beside"", ""description"": ""Noun""}]}}",Vocab,13,nearby; in the neighborhood,,私の家の近くに公園があります。,
N5,,,地図,ちず,Noun,I am looking at a map.,"{""vocabulary"": [{""word"": ""私"", ""reading"": ""わたし"", ""meaning"": ""I"", ""role"": ""Pronoun"", ""components"": [], ""combined_explanation"": """"}, {""word"": ""は"", ""reading"": ""は"", ""meaning"": ""[Topic Marker]"", ""role"": ""Particle"", ""components"": [], ""combined_explanation"": """"}, {""word"": ""地図"", ""reading"": ""ちず"", ""meaning"": ""map"", ""role"": ""Noun"", ""components"": [], ""combined_explanation"": """"}, {""word"": ""を"", ""reading"": ""を"", ""meaning"": ""[Object Marker]"", ""role"": ""Particle"", ""components"": [], ""combined_explanation"": """"}, {""word"": ""見ています"", ""reading"": ""みています"", ""meaning"": ""am looking"", ""role"": ""Verb, present continuous"", ""components"": [], ""combined_explanation"": """"}], ""grammar"": {""context"": ""This sentence describes an action where the speaker is currently looking at a map. It conveys a sense of immediacy and ongoing activity."", ""steps"": [""**私** - Refers to the speaker, “I.”"", ""**は** - Marks “私” as the topic of the sentence."", ""**地図** - Indicates the object of the action, “map.”"", ""**を** - Marks “地図” as the direct object of the verb."", ""**見ています** - The present continuous form of “見る,” indicating that the action of looking is currently happening.""], ""sentence_pattern"": ""- [Topic] + [は] + [Object] + [を] + [Verb (present continuous)]\n- **Kanji**: 彼は本を読んでいます。\n- **Hiragana**: かれはほんをよんでいます。\n- **English Translation**: He is reading a book."", ""sentence_pattern_kanji"": ""彼は本を読んでいます。"", ""sentence_pattern_hiragana"": ""かれはほんをよんでいます。"", ""sentence_pattern_english"": ""He is reading a book."", ""contribution"": """"}, ""tips"": {""tip"": ""Remember that the particle は marks the topic of the sentence, while を marks the object of the verb. This helps clarify who is doing the action and what the action is directed towards."", ""common_mistake"": ""Beginners often confuse the use of を and は. Make sure to use を for the object of the verb and は for the topic of the sentence."", ""alternative_expression"": {""kanji"": ""私は地図を見ている。"", ""hiragana"": ""わたしはちずをみている。"", ""english"": ""I am looking at a map.""}, ""new_words_in_alternative"": [{""word"": ""見ている"", ""reading"": ""みている"", ""meaning"": ""am looking"", ""description"": ""Verb, present continuous""}]}}",Vocab,13,a map,,私は地図を見ています。,
N5,,,着く,つく,Godan verb with 'ku' ending,I arrive at school.,"{""vocabulary"": [{""word"": ""学校"", ""reading"": ""がっこう"", ""meaning"": ""school"", ""role"": ""Noun"", ""components"": [], ""combined_explanation"": """"}, {""word"": ""に"", ""reading"": ""に"", ""meaning"": ""[Direction/Location Marker]"", ""role"": ""Particle"", ""components"": [], ""combined_explanation"": """"}, {""word"": ""着く"", ""reading"": ""つく"", ""meaning"": ""to arrive"", ""role"": ""Verb, dictionary form"", ""components"": [{""part"": ""着"", ""reading"": ""つ"", ""meaning"": ""to arrive"", ""contribution"": ""Verb root""}], ""combined_explanation"": """"}], ""grammar"": {""context"": ""This sentence expresses the action of arriving at a specific location, which in this case is a school. It indicates that the speaker is reaching their destination."", ""steps"": [""**学校** - Refers to the location, “school.”"", ""**に** - Indicates the direction or destination of the action, meaning “to” or “at.”"", ""**着く** - The verb meaning “to arrive,” in its dictionary form, indicating the action being performed.""], ""sentence_pattern"": ""- [Location] + [に] + [Verb (dictionary form)]\n- **Kanji**: 彼は駅に着く。\n- **Hiragana**: かれはえきにつく。\n- **English Translation**: He arrives at the station."", ""sentence_pattern_kanji"": ""彼は駅に着く。"", ""sentence_pattern_hiragana"": ""かれはえきにつく。"", ""sentence_pattern_english"": ""He arrives at the station."", ""contribution"": """"}, ""tips"": {""tip"": ""Remember that に is used to indicate the destination of an action. It helps clarify where you are going or where something is happening."", ""common_mistake"": ""Beginners often confuse に with へ. While both can indicate direction, に is more specific for indicating a destination where an action occurs, while へ indicates direction more generally."", ""alternative_expression"": {""kanji"": ""学校に行く。"", ""hiragana"": ""がっこうにいく。"", ""english"": ""I go to school.""}, ""new_words_in_alternative"": [{""word"": ""行く"", ""reading"": ""いく"", ""meaning"": ""to go"", ""description"": ""Verb, dictionary form""}]}}",Vocab,13,"to arrive at, to reach",,学校に着く。,
N5,,,電車,でんしゃ,Noun,I go to school by train every morning.,"{""vocabulary"": [{""word"": ""私"", ""reading"": ""わたし"", ""meaning"": ""I"", ""role"": ""Pronoun"", ""components"": [], ""combined_explanation"": """"}, {""word"": ""は"", ""reading"": ""は"", ""meaning"": ""[Topic Marker]"", ""role"": ""Particle"", ""components"": [], ""combined_explanation"": """"}, {""word"": ""毎朝"", ""reading"": ""まいあさ"", ""meaning"": ""every morning"", ""role"": ""Adverbial phrase"", ""components"": [], ""combined_explanation"": """"}, {""word"": ""電車"", ""reading"": ""でんしゃ"", ""meaning"": ""train"", ""role"": ""Noun"", ""components"": [], ""combined_explanation"": """"}, {""word"": ""で"", ""reading"": ""で"", ""meaning"": ""[Means/Method Marker]"", ""role"": ""Particle"", ""components"": [], ""combined_explanation"": """"}, {""word"": ""学校"", ""reading"": ""がっこう"", ""meaning"": ""school"", ""role"": ""Noun"", ""components"": [], ""combined_explanation"": """"}, {""word"": ""に"", ""reading"": ""に"", ""meaning"": ""[Destination Marker]"", ""role"": ""Particle"", ""components"": [], ""combined_explanation"": """"}, {""word"": ""行きます"", ""reading"": ""いきます"", ""meaning"": ""go"", ""role"": ""Verb, polite form"", ""components"": [{""part"": ""行く"", ""reading"": ""いく"", ""meaning"": ""to go"", ""contribution"": ""Verb""}], ""combined_explanation"": """"}], ""grammar"": {""context"": ""This sentence describes a daily routine where the speaker travels to school using a train every morning. It emphasizes the regularity of the action."", ""steps"": [""**私** - Refers to the speaker, marking them as the topic of the sentence."", ""**は** - Marks “私” as the topic."", ""**毎朝** - Indicates the frequency of the action, meaning “every morning.”"", ""**電車** - Specifies the means of transportation, “train.”"", ""**で** - Indicates the method of transportation."", ""**学校** - Refers to the destination, “school.”"", ""**に** - Marks “学校” as the destination of the action."", ""**行きます** - The polite form of “行く,” indicating the action of going.""], ""sentence_pattern"": ""- [Topic] + [は] + [Frequency] + [Means] + [Destination] + [に] + [Verb (polite form)]\n- **Kanji**: 彼は毎日自転車で会社に行きます。\n- **Hiragana**: かれはまいにちじてんしゃでかいしゃにいきます。\n- **English Translation**: He goes to the office by bicycle every day."", ""sentence_pattern_kanji"": ""彼は毎日自転車で会社に行きます。"", ""sentence_pattern_hiragana"": ""かれはまいにちじてんしゃでかいしゃにいきます。"", ""sentence_pattern_english"": ""He goes to the office by bicycle every day."", ""contribution"": """"}, ""tips"": {""tip"": ""Remember that は marks the topic of the sentence, which helps to clarify who is performing the action. In this case, it’s the speaker who goes to school."", ""common_mistake"": ""Beginners often confuse に and で. Remember that に indicates the destination (where you are going), while で indicates the means or method of transportation."", ""alternative_expression"": {""kanji"": ""私は毎朝バスで学校に行きます。"", ""hiragana"": ""わたしはまいあさばすでがっこうにいきます。"", ""english"": ""I go to school by bus every morning.""}, ""new_words_in_alternative"": [{""word"": ""バス"", ""reading"": ""ばす"", ""meaning"": ""bus"", ""description"": ""Noun""}]}}",Vocab,13,electric train,,私は毎朝電車で学校に行きます。,
N5,,,所,ところ,Noun,This is my favorite place.,"{""vocabulary"": [{""word"": ""ここ"", ""reading"": ""ここ"", ""meaning"": ""here"", ""role"": ""Adverb"", ""components"": [], ""combined_explanation"": """"}, {""word"": ""は"", ""reading"": ""は"", ""meaning"": ""[Topic Marker]"", ""role"": ""Particle"", ""components"": [], ""combined_explanation"": "" **私 (わたし)**: “I” or “me” - [Pronoun]""}, {""word"": ""の"", ""reading"": ""の"", ""meaning"": ""[Possessive Marker]"", ""role"": ""Particle"", ""components"": [], ""combined_explanation"": "" **好きな (すきな)**: “favorite” or “like” - [Adjective, attributive form]""}, {""word"": ""所"", ""reading"": ""ところ"", ""meaning"": ""place"", ""role"": ""Noun"", ""components"": [], ""combined_explanation"": """"}, {""word"": ""です"", ""reading"": ""です"", ""meaning"": ""[Copula]"", ""role"": ""Particle"", ""components"": [], ""combined_explanation"": """"}], ""grammar"": {""context"": ""This sentence expresses the speaker's identification of a specific location as their favorite place. It conveys a sense of personal attachment or preference regarding that location."", ""steps"": [""**ここ** - Indicates the location being referred to, meaning \""here.\"""", ""**は** - Marks \""ここ\"" as the topic of the sentence."", ""**私** - Refers to the speaker, indicating possession."", ""**の** - Indicates that what follows belongs to the speaker."", ""**好きな** - An attributive form of the adjective \""好き\"" (suki), meaning \""like\"" or \""favorite,\"" modifying \""所.\"""", ""**所** - Refers to a \""place.\"""", ""**です** - A polite ending particle that functions as a copula, linking the subject to the predicate.""], ""sentence_pattern"": ""- [Location] + [は] + [Pronoun] + [の] + [Adjective (attributive)] + [Noun] + [です]\n- **Kanji**: ここは私の好きな所です。\n- **Hiragana**: ここはわたしのすきなところです。\n- **English Translation**: This is my favorite place."", ""sentence_pattern_kanji"": ""ここは私の好きな所です。"", ""sentence_pattern_hiragana"": ""ここはわたしのすきなところです。"", ""sentence_pattern_english"": ""This is my favorite place."", ""contribution"": """"}, ""tips"": {""tip"": ""Remember that の is used to indicate possession, linking the pronoun \""私\"" (I) to \""好きな所\"" (favorite place). This structure is common in Japanese for expressing ownership or preference."", ""common_mistake"": ""Beginners often confuse the use of は and が. In this context, は is used to mark the topic (the place), while が is typically used for the subject of a sentence."", ""alternative_expression"": {""kanji"": ""ここは私のお気に入りの場所です。"", ""hiragana"": ""ここはわたしのおきにいりのばしょです。"", ""english"": ""This is my favorite spot.""}, ""new_words_in_alternative"": [{""word"": ""お気に入り"", ""reading"": ""おきにいり"", ""meaning"": ""favorite"", ""description"": ""Noun""}, {""word"": ""場所"", ""reading"": ""ばしょ"", ""meaning"": ""place"", ""description"": ""Noun""}]}}",Vocab,13,place,,ここは私の好きな所です。,
N5,,,隣,となり,Noun,The person sitting next to me is my friend.,"{""vocabulary"": [{""word"": ""私"", ""reading"": ""わたし"", ""meaning"": ""I"", ""role"": ""Pronoun"", ""components"": [], ""combined_explanation"": """"}, {""word"": ""の"", ""reading"": ""の"", ""meaning"": ""[Possessive particle]"", ""role"": ""Particle"", ""components"": [], ""combined_explanation"": """"}, {""word"": ""隣"", ""reading"": ""となり"", ""meaning"": ""next to"", ""role"": ""Noun"", ""components"": [], ""combined_explanation"": """"}, {""word"": ""に"", ""reading"": ""に"", ""meaning"": ""[Location/Direction particle]"", ""role"": ""Particle"", ""components"": [], ""combined_explanation"": """"}, {""word"": ""座っている"", ""reading"": ""すわっている"", ""meaning"": ""sitting"", ""role"": ""Verb, continuous form"", ""components"": [], ""combined_explanation"": """"}, {""word"": ""人"", ""reading"": ""ひと"", ""meaning"": ""person"", ""role"": ""Noun"", ""components"": [], ""combined_explanation"": """"}, {""word"": ""は"", ""reading"": ""は"", ""meaning"": ""[Topic marker]"", ""role"": ""Particle"", ""components"": [], ""combined_explanation"": """"}, {""word"": ""友達"", ""reading"": ""ともだち"", ""meaning"": ""friend"", ""role"": ""Noun"", ""components"": [], ""combined_explanation"": """"}, {""word"": ""です"", ""reading"": ""です"", ""meaning"": ""[Copula]"", ""role"": ""Particle"", ""components"": [{""part"": ""座って"", ""reading"": ""すわって"", ""meaning"": ""sitting"", ""contribution"": ""Verb, te-form""}, {""part"": ""座る"", ""reading"": ""すわる"", ""meaning"": ""to sit"", ""contribution"": ""Verb""}, {""part"": ""いる"", ""reading"": ""いる"", ""meaning"": ""to be (animate)"", ""contribution"": ""Verb""}], ""combined_explanation"": """"}], ""grammar"": {""context"": ""This sentence describes a situation where the speaker identifies a person who is currently sitting next to them as their friend. It provides a clear relationship between the speaker and the person mentioned."", ""steps"": [""**私の** - “My” indicates possession, showing that the speaker is referring to their own space."", ""**隣に** - Indicates the location, meaning “next to.”"", ""**座っている** - The continuous form of the verb “to sit,” indicating that the action is currently happening."", ""**人は** - Marks “person” as the topic of the sentence."", ""**友達です** - Concludes with the identification of the person as a friend, using the copula “です” to affirm the statement.""], ""sentence_pattern"": ""- [Possessive Pronoun] + [Location] + [に] + [Verb (continuous)] + [Topic] + [は] + [Noun] + [です]\n- **Kanji**: 彼の隣に座っている人は先生です。\n- **Hiragana**: かれのとなりにすわっているひとはせんせいです。\n- **English Translation**: The person sitting next to him is a teacher."", ""sentence_pattern_kanji"": ""彼の隣に座っている人は先生です。"", ""sentence_pattern_hiragana"": ""かれのとなりにすわっているひとはせんせいです。"", ""sentence_pattern_english"": ""The person sitting next to him is a teacher."", ""contribution"": """"}, ""tips"": {""tip"": ""Remember that の indicates possession, so 私の means “my.” This is a common structure in Japanese to show ownership or relationship."", ""common_mistake"": ""Beginners often confuse the use of は and が. In this context, は is used to mark the topic of the sentence (the person), while が is typically used for the subject of a sentence."", ""alternative_expression"": {""kanji"": ""私の隣にいる人は友達です。"", ""hiragana"": ""わたしのとなりにいるひとはともだちです。"", ""english"": ""The person who is next to me is my friend.""}, ""new_words_in_alternative"": [{""word"": ""いる"", ""reading"": ""いる"", ""meaning"": ""to be (animate)"", ""description"": ""Verb""}]}}",Vocab,13,"next to, next door to",,私の隣に座っている人は友達です。,
N5,,,中,なか,Noun,There is a toy inside the box.,"{""vocabulary"": [{""word"": ""箱"", ""reading"": ""はこ"", ""meaning"": ""box"", ""role"": ""Noun"", ""components"": [], ""combined_explanation"": """"}, {""word"": ""の"", ""reading"": ""の"", ""meaning"": ""[Possessive/Attributive particle]"", ""role"": ""Particle"", ""components"": [], ""combined_explanation"": """"}, {""word"": ""中"", ""reading"": ""なか"", ""meaning"": ""inside"", ""role"": ""Noun"", ""components"": [], ""combined_explanation"": """"}, {""word"": ""に"", ""reading"": ""に"", ""meaning"": ""[Location/Direction particle]"", ""role"": ""Particle"", ""components"": [], ""combined_explanation"": """"}, {""word"": ""おもちゃ"", ""reading"": ""おもちゃ"", ""meaning"": ""toy"", ""role"": ""Noun"", ""components"": [], ""combined_explanation"": """"}, {""word"": ""が"", ""reading"": ""が"", ""meaning"": ""[Subject Marker]"", ""role"": ""Particle"", ""components"": [], ""combined_explanation"": """"}, {""word"": ""あります"", ""reading"": ""あります"", ""meaning"": ""there is"", ""role"": ""Verb, polite form"", ""components"": [], ""combined_explanation"": """"}], ""grammar"": {""context"": ""This sentence describes the presence of a toy located inside a box. It provides a clear spatial relationship between the toy and the box."", ""steps"": [""**箱** - Refers to the object, the box."", ""**の** - Indicates that the following noun (中) is related to the box, forming the phrase “inside the box.”"", ""**中** - Specifies the location, meaning “inside.”"", ""**に** - Indicates the location where the toy exists."", ""**おもちゃ** - Refers to the subject of the sentence, the toy."", ""**が** - Marks “おもちゃ” as the subject of the sentence."", ""**あります** - The polite form of the verb “ある,” indicating that the toy exists in the specified location.""], ""sentence_pattern"": ""- [Noun 1] + [の] + [Noun 2] + [に] + [Noun (subject)] + [が] + [Verb (polite form)]\n- **Kanji**: 机の上に本があります。\n- **Hiragana**: つくえのうえにほんがあります。\n- **English Translation**: There is a book on the desk."", ""sentence_pattern_kanji"": ""机の上に本があります。"", ""sentence_pattern_hiragana"": ""つくえのうえにほんがあります。"", ""sentence_pattern_english"": ""There is a book on the desk."", ""contribution"": """"}, ""tips"": {""tip"": ""Remember that の connects nouns to show possession or location, while に indicates where something exists. This helps clarify the relationship between objects in a sentence."", ""common_mistake"": ""Beginners often confuse the use of が and は. In this context, が is used to mark the subject (the toy), while は would indicate a broader topic of discussion."", ""alternative_expression"": {""kanji"": ""箱の中におもちゃがある。"", ""hiragana"": ""はこのなかにおもちゃがある。"", ""english"": ""A toy is inside the box.""}, ""new_words_in_alternative"": []}}",Vocab,13,"inside, middle, among",,箱の中におもちゃがあります。,
N5,,,西,にし,Noun,The school is to the west.,"{""vocabulary"": [{""word"": ""学校"", ""reading"": ""がっこう"", ""meaning"": ""school"", ""role"": ""Noun"", ""components"": [], ""combined_explanation"": """"}, {""word"": ""は"", ""reading"": ""は"", ""meaning"": ""[Topic Marker]"", ""role"": ""Particle"", ""components"": [], ""combined_explanation"": """"}, {""word"": ""西"", ""reading"": ""にし"", ""meaning"": ""west"", ""role"": ""Noun"", ""components"": [], ""combined_explanation"": """"}, {""word"": ""に"", ""reading"": ""に"", ""meaning"": ""[Direction/Location Marker]"", ""role"": ""Particle"", ""components"": [], ""combined_explanation"": """"}, {""word"": ""あります"", ""reading"": ""あります"", ""meaning"": ""exists / is located"", ""role"": ""Verb, polite form"", ""components"": [], ""combined_explanation"": """"}], ""grammar"": {""context"": ""This sentence describes the location of a school, indicating that it is situated to the west of the speaker or a reference point. It provides clear spatial information."", ""steps"": [""**学校** - Refers to the subject of the sentence, which is the school."", ""**は** - Marks “学校” as the topic of the sentence."", ""**西** - Indicates the direction where the school is located."", ""**に** - Marks the direction or location where the subject exists."", ""**あります** - The polite form of the verb “ある,” indicating that the school exists in that location.""], ""sentence_pattern"": ""- [Topic] + [は] + [Direction] + [に] + [Verb (polite form)]\n- **Kanji**: 彼は南に住んでいます。\n- **Hiragana**: かれはみなみにすんでいます。\n- **English Translation**: He lives to the south."", ""sentence_pattern_kanji"": ""彼は南に住んでいます。"", ""sentence_pattern_hiragana"": ""かれはみなみにすんでいます。"", ""sentence_pattern_english"": ""He lives to the south."", ""contribution"": """"}, ""tips"": {""tip"": ""Remember that は marks the topic of the sentence, while に indicates the direction or location. This structure helps clarify where something is situated."", ""common_mistake"": ""Beginners often confuse に with へ. While both can indicate direction, に is used for specific locations or existence, whereas へ indicates direction towards a destination."", ""alternative_expression"": {""kanji"": ""学校は西側にあります。"", ""hiragana"": ""がっこうはにしがわにあります。"", ""english"": ""The school is located on the west side.""}, ""new_words_in_alternative"": [{""word"": ""側"", ""reading"": ""がわ"", ""meaning"": ""side"", ""description"": ""Noun""}]}}",Vocab,13,west,,学校は西にあります。,
