JLPT,Example Words,Onyomi,Word,Reading,Word Type,Example Sentence EN,breakdown,type,Lesson,Meaning,Kanji,Example Sentence JP,Kunyomi
N5,,,どちら,どちら,Pronoun,Which one do you like?,"{""vocabulary"": [{""word"": ""どちら"", ""reading"": ""どちら"", ""meaning"": ""which one"", ""role"": ""Pronoun"", ""components"": [], ""combined_explanation"": """"}, {""word"": ""が"", ""reading"": ""が"", ""meaning"": ""[Subject Marker]"", ""role"": ""Particle"", ""components"": [], ""combined_explanation"": """"}, {""word"": ""好き"", ""reading"": ""すき"", ""meaning"": ""like"", ""role"": ""Adjective"", ""components"": [], ""combined_explanation"": """"}, {""word"": ""です"", ""reading"": ""です"", ""meaning"": ""is"", ""role"": ""Copula"", ""components"": [], ""combined_explanation"": """"}, {""word"": ""か"", ""reading"": ""か"", ""meaning"": ""[Question Marker]"", ""role"": ""Particle"", ""components"": [], ""combined_explanation"": """"}], ""grammar"": {""context"": ""This sentence is a question asking someone about their preference between two or more options. It is commonly used in conversations when discussing choices."", ""steps"": [""**どちら** - Refers to the options being considered, meaning \""which one.\"""", ""**が** - Marks the subject of the sentence, indicating that \""どちら\"" is what is being liked."", ""**好き** - An adjective that expresses liking or preference."", ""**です** - A polite ending that functions as a copula, making the sentence more formal."", ""**か** - Indicates that the sentence is a question.""], ""sentence_pattern"": ""- [Which one] + [が] + [Adjective] + [ですか]\n- **Kanji**: あなたはどちらが好きですか？\n- **Hiragana**: あなたはどちらがすきですか？\n- **English Translation**: Which one do you like?"", ""sentence_pattern_kanji"": ""あなたはどちらが好きですか？"", ""sentence_pattern_hiragana"": ""あなたはどちらがすきですか？"", ""sentence_pattern_english"": ""Which one do you like?"", ""contribution"": """"}, ""tips"": {""tip"": ""Remember that どちら is used when you want to ask about a choice between two or more items. It’s a polite way to inquire about preferences."", ""common_mistake"": ""Beginners often confuse どちら with どれ. While both mean \""which,\"" どちら is used for two options, and どれ is used for three or more."", ""alternative_expression"": {""kanji"": ""どれが好きですか？"", ""hiragana"": ""どれがすきですか？"", ""english"": ""Which one do you like? (referring to three or more options)""}, ""new_words_in_alternative"": [{""word"": ""どれ"", ""reading"": ""どれ"", ""meaning"": ""which (one)"", ""description"": ""Pronoun""}]}}",Vocab,3,which (one); where (polite),,どちらが好きですか？,
N5,,,どっち,どっち,Pronoun,"Which do you like, apples or bananas?","{""vocabulary"": [{""word"": ""りんご"", ""reading"": ""りんご"", ""meaning"": ""apple"", ""role"": ""Noun"", ""components"": [], ""combined_explanation"": """"}, {""word"": ""と"", ""reading"": ""と"", ""meaning"": ""and"", ""role"": ""Particle"", ""components"": [], ""combined_explanation"": """"}, {""word"": ""バナナ"", ""reading"": ""ばなな"", ""meaning"": ""banana"", ""role"": ""Noun"", ""components"": [], ""combined_explanation"": """"}, {""word"": ""どっち"", ""reading"": ""どっち"", ""meaning"": ""which"", ""role"": ""Pronoun"", ""components"": [], ""combined_explanation"": """"}, {""word"": ""が"", ""reading"": ""が"", ""meaning"": ""[Subject Marker]"", ""role"": ""Particle"", ""components"": [], ""combined_explanation"": """"}, {""word"": ""好き"", ""reading"": ""すき"", ""meaning"": ""like"", ""role"": ""Adjective"", ""components"": [], ""combined_explanation"": """"}, {""word"": ""です"", ""reading"": ""です"", ""meaning"": ""is"", ""role"": ""Copula"", ""components"": [], ""combined_explanation"": """"}, {""word"": ""か"", ""reading"": ""か"", ""meaning"": ""[Question Marker]"", ""role"": ""Particle"", ""components"": [], ""combined_explanation"": """"}], ""grammar"": {""context"": ""This sentence is a question asking someone about their preference between two fruits: apples and bananas. It invites the listener to express their liking for one of the options."", ""steps"": [""**りんごとバナナ** - Lists the two items being compared (apples and bananas)."", ""**どっち** - Asks which of the two items is preferred."", ""**が** - Marks “どっち” as the subject of the sentence."", ""**好き** - Indicates the action of liking or preference."", ""**ですか** - The polite form of the verb “to be” used to turn the statement into a question.""], ""sentence_pattern"": ""- [Item 1] + [と] + [Item 2] + [、] + [どっち] + [が] + [好き] + [ですか]\n- **Kanji**: りんごとバナナ、どちらが好きですか？\n- **Hiragana**: りんごとばなな、どちらがすきですか？\n- **English Translation**: Which do you like, apples or bananas?"", ""sentence_pattern_kanji"": ""りんごとバナナ、どちらが好きですか？"", ""sentence_pattern_hiragana"": ""りんごとばなな、どちらがすきですか？"", ""sentence_pattern_english"": ""Which do you like, apples or bananas?"", ""contribution"": """"}, ""tips"": {""tip"": ""Remember that どっち is used when asking for a choice between two options. It’s a casual way to ask “which one?”"", ""common_mistake"": ""Beginners might confuse どっち with どれ, which is used for three or more options. Use どっち specifically for two items."", ""alternative_expression"": {""kanji"": ""りんごとバナナ、どちらが好みですか？"", ""hiragana"": ""りんごとばなな、どちらがこのみですか？"", ""english"": ""Which do you prefer, apples or bananas?""}, ""new_words_in_alternative"": [{""word"": ""好み"", ""reading"": ""このみ"", ""meaning"": ""preference"", ""description"": ""Noun""}]}}",Vocab,3,which one,,りんごとバナナ、どっちが好きですか？,
N5,,,どなた,どなた,Pronoun,Who is that person?,"{""vocabulary"": [{""word"": ""あの"", ""reading"": ""あの"", ""meaning"": ""that"", ""role"": ""Demonstrative adjective"", ""components"": [], ""combined_explanation"": "" **方 (かた)**: “person” (polite) - [Noun]""}, {""word"": ""は"", ""reading"": ""は"", ""meaning"": ""[Topic Marker]"", ""role"": ""Particle"", ""components"": [], ""combined_explanation"": "" **どなた (どなた)**: “who” (polite) - [Interrogative pronoun]""}, {""word"": ""です"", ""reading"": ""です"", ""meaning"": ""is"", ""role"": ""Copula"", ""components"": [], ""combined_explanation"": """"}, {""word"": ""か"", ""reading"": ""か"", ""meaning"": ""[Question Marker]"", ""role"": ""Particle"", ""components"": [], ""combined_explanation"": """"}], ""grammar"": {""context"": ""This sentence is a polite inquiry about the identity of a person referred to as \""that person.\"" It is often used in formal situations or when speaking to someone respectfully."", ""steps"": [""**あの** - A demonstrative adjective that indicates something that is not close to the speaker but is known to both the speaker and listener."", ""**方** - A polite term for “person,” used to show respect."", ""**は** - Marks “あの方” as the topic of the sentence."", ""**どなた** - A polite way to ask “who,” used in formal contexts."", ""**です** - A copula that links the subject to the predicate, similar to “is” in English."", ""**か** - Indicates that the sentence is a question.""], ""sentence_pattern"": ""- [Topic] + [は] + [Interrogative] + [ですか]\n- **Kanji**: 彼は誰ですか？\n- **Hiragana**: かれはだれですか？\n- **English Translation**: Who is he?"", ""sentence_pattern_kanji"": ""彼は誰ですか？"", ""sentence_pattern_hiragana"": ""かれはだれですか？"", ""sentence_pattern_english"": ""Who is he?"", ""contribution"": """"}, ""tips"": {""tip"": ""Remember that あの is used for things that are not close to the speaker, while その is used for things that are closer. This distinction can help you choose the right demonstrative adjective."", ""common_mistake"": ""Beginners often confuse どなた with だれ. While both mean \""who,\"" どなた is more polite and should be used in formal situations."", ""alternative_expression"": {""kanji"": ""あの人は誰ですか？"", ""hiragana"": ""あのひとはだれですか？"", ""english"": ""Who is that person?""}, ""new_words_in_alternative"": [{""word"": ""人"", ""reading"": ""ひと"", ""meaning"": ""person"", ""description"": ""Noun""}]}}",Vocab,3,who (polite),,あの方はどなたですか？,
N5,,,どれ,どれ,Pronoun,Which one is your book?,"{""vocabulary"": [{""word"": ""どれ"", ""reading"": ""どれ"", ""meaning"": ""which one"", ""role"": ""Pronoun"", ""components"": [], ""combined_explanation"": """"}, {""word"": ""が"", ""reading"": ""が"", ""meaning"": ""[Subject Marker]"", ""role"": ""Particle"", ""components"": [], ""combined_explanation"": """"}, {""word"": ""あなた"", ""reading"": ""あなた"", ""meaning"": ""you"", ""role"": ""Pronoun"", ""components"": [], ""combined_explanation"": """"}, {""word"": ""の"", ""reading"": ""の"", ""meaning"": ""[Possessive Marker]"", ""role"": ""Particle"", ""components"": [], ""combined_explanation"": """"}, {""word"": ""本"", ""reading"": ""ほん"", ""meaning"": ""book"", ""role"": ""Noun"", ""components"": [], ""combined_explanation"": """"}, {""word"": ""です"", ""reading"": ""です"", ""meaning"": ""is"", ""role"": ""Copula"", ""components"": [], ""combined_explanation"": """"}, {""word"": ""か"", ""reading"": ""か"", ""meaning"": ""[Question Marker]"", ""role"": ""Particle"", ""components"": [], ""combined_explanation"": """"}], ""grammar"": {""context"": ""This sentence is a question asking someone to identify which book belongs to them among a selection of books. It is a common way to inquire about possession."", ""steps"": [""**どれ** - Refers to an unspecified item among a group, meaning \""which one.\"""", ""**が** - Marks the subject of the sentence, indicating what is being asked about."", ""**あなた** - Specifies the person being addressed, meaning \""you.\"""", ""**の** - Indicates possession, linking \""you\"" to \""book.\"""", ""**本** - The noun that is the object of inquiry, meaning \""book.\"""", ""**です** - A polite form of the verb \""to be,\"" used here to affirm the identity of the subject."", ""**か** - Indicates that the sentence is a question.""], ""sentence_pattern"": ""- [Question Word] + [が] + [Pronoun] + [の] + [Noun] + [ですか]\n- **Kanji**: どれがあなたの本ですか？\n- **Hiragana**: どれがあなたのほんですか？\n- **English Translation**: Which one is your book?"", ""sentence_pattern_kanji"": ""どれがあなたの本ですか？"", ""sentence_pattern_hiragana"": ""どれがあなたのほんですか？"", ""sentence_pattern_english"": ""Which one is your book?"", ""contribution"": """"}, ""tips"": {""tip"": ""Remember that どれ is used when you are choosing from multiple options. It helps to think of it as \""which one\"" when asking about a specific item."", ""common_mistake"": ""Beginners often confuse the use of が and は. In this context, が is used to mark the subject of the question, while は would indicate the topic, which is not appropriate here."", ""alternative_expression"": {""kanji"": ""あなたの本はどれですか？"", ""hiragana"": ""あなたのほんはどれですか？"", ""english"": ""Which one is your book?""}, ""new_words_in_alternative"": [{""word"": ""は"", ""reading"": ""は"", ""meaning"": ""[Topic Marker]"", ""description"": ""Particle""}]}}",Vocab,3,which one,,どれがあなたの本ですか？,
N5,,,私,わたし,Pronoun,I am a student.,"{""vocabulary"": [{""word"": ""私"", ""reading"": ""わたし"", ""meaning"": ""I"", ""role"": ""Pronoun"", ""components"": [], ""combined_explanation"": """"}, {""word"": ""は"", ""reading"": ""は"", ""meaning"": ""[Topic Marker]"", ""role"": ""Particle"", ""components"": [], ""combined_explanation"": """"}, {""word"": ""学生"", ""reading"": ""がくせい"", ""meaning"": ""student"", ""role"": ""Noun"", ""components"": [], ""combined_explanation"": """"}, {""word"": ""です"", ""reading"": ""です"", ""meaning"": ""is"", ""role"": ""Copula"", ""components"": [], ""combined_explanation"": """"}], ""grammar"": {""context"": ""This sentence expresses the speaker's identity, stating that they are a student. It is a simple declarative statement that introduces the subject and its state of being."", ""steps"": [""**私** - Refers to the speaker, indicating “I.”"", ""**は** - Marks “私” as the topic of the sentence, indicating what the sentence is about."", ""**学生** - Specifies the identity of the speaker, meaning “student.”"", ""**です** - A polite ending that functions as the verb “to be,” linking the subject and the predicate.""], ""sentence_pattern"": ""- [Topic] + [は] + [Noun] + [です]\n- **Kanji**: 彼は先生です。\n- **Hiragana**: かれはせんせいです。\n- **English Translation**: He is a teacher."", ""sentence_pattern_kanji"": ""彼は先生です。"", ""sentence_pattern_hiragana"": ""かれはせんせいです。"", ""sentence_pattern_english"": ""He is a teacher."", ""contribution"": """"}, ""tips"": {""tip"": ""Remember that は indicates the topic of the sentence, which can often be thought of as the subject, but it emphasizes what the sentence is about."", ""common_mistake"": ""Beginners might confuse the use of は and が. In this context, は is used to mark the topic (私), while が is typically used for the subject of a sentence when introducing new information."", ""alternative_expression"": {""kanji"": ""私は学徒です。"", ""hiragana"": ""わたしはがくとです。"", ""english"": ""I am a student.""}, ""new_words_in_alternative"": [{""word"": ""学徒"", ""reading"": ""がくと"", ""meaning"": ""student"", ""description"": ""Noun""}]}}",Vocab,3,"I, me",,私は学生です。,
N5,,,私,わたくし,Pronoun,I am a student.,"{""vocabulary"": [{""word"": ""私"", ""reading"": ""わたし"", ""meaning"": ""I"", ""role"": ""Pronoun"", ""components"": [], ""combined_explanation"": """"}, {""word"": ""は"", ""reading"": ""は"", ""meaning"": ""[Topic Marker]"", ""role"": ""Particle"", ""components"": [], ""combined_explanation"": """"}, {""word"": ""学生"", ""reading"": ""がくせい"", ""meaning"": ""student"", ""role"": ""Noun"", ""components"": [], ""combined_explanation"": """"}, {""word"": ""です"", ""reading"": ""です"", ""meaning"": ""is"", ""role"": ""Copula"", ""components"": [], ""combined_explanation"": """"}], ""grammar"": {""context"": ""This sentence is a simple statement where the speaker identifies themselves as a student. It is a basic introduction that conveys personal information."", ""steps"": [""**私** - Refers to the speaker, meaning “I.”"", ""**は** - Marks “私” as the topic of the sentence."", ""**学生** - Indicates the role or identity of the speaker, meaning “student.”"", ""**です** - A polite ending that functions as the verb “to be,” linking the subject to the predicate.""], ""sentence_pattern"": ""- [Topic] + [は] + [Noun] + [です]\n- **Kanji**: 彼は先生です。\n- **Hiragana**: かれはせんせいです。\n- **English Translation**: He is a teacher."", ""sentence_pattern_kanji"": ""彼は先生です。"", ""sentence_pattern_hiragana"": ""かれはせんせいです。"", ""sentence_pattern_english"": ""He is a teacher."", ""contribution"": """"}, ""tips"": {""tip"": ""Remember that は marks the topic of the sentence, which is often the subject. In this case, it emphasizes that the speaker is talking about themselves."", ""common_mistake"": ""Beginners sometimes confuse the use of です with other verbs. Remember that です is used to link the subject with a noun or adjective in a polite manner."", ""alternative_expression"": {""kanji"": ""私は学徒です。"", ""hiragana"": ""わたしはがくとです。"", ""english"": ""I am a learner.""}, ""new_words_in_alternative"": [{""word"": ""学徒"", ""reading"": ""がくと"", ""meaning"": ""learner"", ""description"": ""Noun""}]}}",Vocab,3,"I (formal), myself",,私は学生です。,
N5,,,で,で,Particle,I play in the park.,"{""vocabulary"": [{""word"": ""公園"", ""reading"": ""こうえん"", ""meaning"": ""park"", ""role"": ""Noun"", ""components"": [], ""combined_explanation"": """"}, {""word"": ""で"", ""reading"": ""で"", ""meaning"": ""[Location Marker]"", ""role"": ""Particle"", ""components"": [], ""combined_explanation"": """"}, {""word"": ""遊びます"", ""reading"": ""あそびます"", ""meaning"": ""play"", ""role"": ""Verb, polite form"", ""components"": [{""part"": ""遊ぶ"", ""reading"": ""あそぶ"", ""meaning"": ""to play"", ""contribution"": ""Verb""}], ""combined_explanation"": """"}], ""grammar"": {""context"": ""This sentence describes an action where the speaker engages in playing at a specific location, which is the park. It conveys a simple activity in a polite manner."", ""steps"": [""**公園** - Refers to the location where the action takes place, meaning \""park.\"""", ""**で** - Indicates the location of the action, meaning \""at\"" or \""in.\"""", ""**遊びます** - The polite form of the verb “遊ぶ,” indicating the action of playing.""], ""sentence_pattern"": ""- [Location] + [で] + [Verb (polite form)]\n- **Kanji**: 学校で勉強します。\n- **Hiragana**: がっこうでべんきょうします。\n- **English Translation**: I study at school."", ""sentence_pattern_kanji"": ""学校で勉強します。"", ""sentence_pattern_hiragana"": ""がっこうでべんきょうします。"", ""sentence_pattern_english"": ""I study at school."", ""contribution"": """"}, ""tips"": {""tip"": ""Remember that で indicates the location where the action occurs. It helps to visualize where you are doing the action."", ""common_mistake"": ""Beginners sometimes confuse で with に. While で marks the location of the action, に indicates direction or a destination."", ""alternative_expression"": {""kanji"": ""公園で遊ぶ。"", ""hiragana"": ""こうえんであそぶ。"", ""english"": ""I play in the park. (casual)""}, ""new_words_in_alternative"": [{""word"": ""遊ぶ"", ""reading"": ""あそぶ"", ""meaning"": ""to play"", ""description"": ""Verb""}]}}",Grammar,3,in; at; on; by; with; via,,公園で遊びます。,
N5,,,が,が,Particle,I like cats.,"{""vocabulary"": [{""word"": ""猫"", ""reading"": ""ねこ"", ""meaning"": ""cat"", ""role"": ""Noun"", ""components"": [], ""combined_explanation"": """"}, {""word"": ""が"", ""reading"": ""が"", ""meaning"": ""[Subject Marker]"", ""role"": ""Particle"", ""components"": [], ""combined_explanation"": """"}, {""word"": ""好き"", ""reading"": ""すき"", ""meaning"": ""like"", ""role"": ""Adjective"", ""components"": [], ""combined_explanation"": """"}, {""word"": ""です"", ""reading"": ""です"", ""meaning"": ""[Polite ending particle]"", ""role"": ""Copula"", ""components"": [], ""combined_explanation"": """"}], ""grammar"": {""context"": ""This sentence expresses the speaker's fondness for cats. It is a simple statement indicating a preference or liking."", ""steps"": [""**猫** - Refers to the subject of the sentence, which is \""cats.\"""", ""**が** - Marks “猫” as the subject of the sentence."", ""**好き** - An adjective that expresses liking or fondness."", ""**です** - A polite ending that makes the sentence more formal.""], ""sentence_pattern"": ""- [Subject] + [が] + [Adjective] + [です]\n- **Kanji**: 彼は犬が好きです。\n- **Hiragana**: かれはいぬがすきです。\n- **English Translation**: He likes dogs."", ""sentence_pattern_kanji"": ""彼は犬が好きです。"", ""sentence_pattern_hiragana"": ""かれはいぬがすきです。"", ""sentence_pattern_english"": ""He likes dogs."", ""contribution"": """"}, ""tips"": {""tip"": ""Remember that the structure \""Xが好きです\"" is a common way to express likes in Japanese. Just replace \""X\"" with whatever you like."", ""common_mistake"": ""Beginners often confuse the subject marker が with the topic marker は. In this case, が is used to emphasize the subject (cats) that the speaker likes."", ""alternative_expression"": {""kanji"": ""猫が大好きです。"", ""hiragana"": ""ねこがだいすきです。"", ""english"": ""I really like cats.""}, ""new_words_in_alternative"": []}}",Grammar,3,subject marker; but,,猫が好きです。,
N5,,,何～,なん～,Pronoun,What kind of book will you read?,"{""vocabulary"": [{""word"": ""何"", ""reading"": ""なに"", ""meaning"": ""what"", ""role"": ""Pronoun"", ""components"": [], ""combined_explanation"": """"}, {""word"": ""の"", ""reading"": ""の"", ""meaning"": ""[Nominalizer/Particle]"", ""role"": ""Particle"", ""components"": [], ""combined_explanation"": """"}, {""word"": ""本"", ""reading"": ""ほん"", ""meaning"": ""book"", ""role"": ""Noun"", ""components"": [], ""combined_explanation"": """"}, {""word"": ""を"", ""reading"": ""を"", ""meaning"": ""[Object Marker]"", ""role"": ""Particle"", ""components"": [], ""combined_explanation"": """"}, {""word"": ""読みます"", ""reading"": ""よみます"", ""meaning"": ""will read"", ""role"": ""Verb, polite form"", ""components"": [], ""combined_explanation"": """"}, {""word"": ""か"", ""reading"": ""か"", ""meaning"": ""[Question Marker]"", ""role"": ""Particle"", ""components"": [], ""combined_explanation"": """"}], ""grammar"": {""context"": ""This sentence is a question asking someone about the type of book they intend to read. It is a polite inquiry that seeks specific information about the subject's reading choice."", ""steps"": [""**何** - Asks for information, meaning “what.”"", ""**の** - Connects the question word to the noun, indicating that “what” is describing the type of book."", ""**本** - The noun that refers to “book.”"", ""**を** - Marks “本” as the object of the verb, indicating what is being read."", ""**読みます** - The polite form of the verb “読む” (to read), indicating future intention or habitual action."", ""**か** - Indicates that the sentence is a question.""], ""sentence_pattern"": ""- [何] + [の] + [Noun] + [を] + [Verb] + [か]\n- **Kanji**: 何の映画を見ますか？\n- **Hiragana**: なんのえいがをみますか？\n- **English Translation**: What kind of movie will you watch?"", ""sentence_pattern_kanji"": ""何の映画を見ますか？"", ""sentence_pattern_hiragana"": ""なんのえいがをみますか？"", ""sentence_pattern_english"": ""What kind of movie will you watch?"", ""contribution"": """"}, ""tips"": {""tip"": ""Remember that 何の is used to ask about the type or kind of something, making it a useful phrase for inquiries about categories or specifics."", ""common_mistake"": ""Beginners might confuse the use of の with other particles. Remember that の is used here to connect the question word 何 with the noun 本, indicating the type of book."", ""alternative_expression"": {""kanji"": ""どんな本を読みますか？"", ""hiragana"": ""どんなほんをよみますか？"", ""english"": ""What kind of book will you read?""}, ""new_words_in_alternative"": [{""word"": ""どんな"", ""reading"": ""どんな"", ""meaning"": ""what kind of"", ""description"": ""Adjective""}]}}",Grammar,3,what kind of ~,,何の本を読みますか？,
