JLPT,Example Words,Onyomi,Word,Reading,Word Type,Example Sentence EN,breakdown,type,Lesson,Meaning,Kanji,Example Sentence JP,Kunyomi
N5,,,とても,とても,Adverb (fukushi),This cake is very delicious.,"{""vocabulary"": [{""word"": ""この"", ""reading"": ""この"", ""meaning"": ""this"", ""role"": ""Demonstrative adjective"", ""components"": [], ""combined_explanation"": """"}, {""word"": ""ケーキ"", ""reading"": ""けーき"", ""meaning"": ""cake"", ""role"": ""Noun"", ""components"": [], ""combined_explanation"": """"}, {""word"": ""は"", ""reading"": ""は"", ""meaning"": ""[Topic Marker]"", ""role"": ""Particle"", ""components"": [], ""combined_explanation"": """"}, {""word"": ""とても"", ""reading"": ""とても"", ""meaning"": ""very"", ""role"": ""Adverb"", ""components"": [], ""combined_explanation"": """"}, {""word"": ""おいしい"", ""reading"": ""おいしい"", ""meaning"": ""delicious"", ""role"": ""Adjective, present tense"", ""components"": [], ""combined_explanation"": """"}, {""word"": ""です"", ""reading"": ""です"", ""meaning"": ""is"", ""role"": ""Copula"", ""components"": [], ""combined_explanation"": """"}], ""grammar"": {""context"": ""This sentence expresses the speaker's opinion about a specific cake, indicating that they find it to be very delicious. It is a simple declarative statement."", ""steps"": [""**この** - Specifies which cake is being referred to, indicating proximity (this cake)."", ""**ケーキ** - The subject of the sentence, which is the cake being discussed."", ""**は** - Marks “ケーキ” as the topic of the sentence."", ""**とても** - Modifies the adjective to indicate a high degree of deliciousness."", ""**おいしい** - Describes the cake, stating that it is delicious."", ""**です** - A polite ending that confirms the statement.""], ""sentence_pattern"": ""- [Demonstrative] + [Noun] + [は] + [Adverb] + [Adjective] + [です]\n- **Kanji**: このケーキはとてもおいしいです。\n- **Hiragana**: このけーきはとてもおいしいです。\n- **English Translation**: This cake is very delicious."", ""sentence_pattern_kanji"": ""このケーキはとてもおいしいです。"", ""sentence_pattern_hiragana"": ""このけーきはとてもおいしいです。"", ""sentence_pattern_english"": ""This cake is very delicious."", ""contribution"": """"}, ""tips"": {""tip"": ""Remember that は marks the topic of the sentence, which is often the subject, but not always. It helps to focus on what the sentence is about."", ""common_mistake"": ""Beginners sometimes confuse です with other forms of the verb “to be.” In Japanese, です is used for polite statements, while other forms may be used in casual speech."", ""alternative_expression"": {""kanji"": ""このケーキはすごくおいしいです。"", ""hiragana"": ""このけーきはすごくおいしいです。"", ""english"": ""This cake is really delicious.""}, ""new_words_in_alternative"": [{""word"": ""すごく"", ""reading"": ""すごく"", ""meaning"": ""really"", ""description"": ""Adverb""}]}}",Vocab,4,very; extremely,,このケーキはとてもおいしいです。,
N5,,,お皿,おさら,Noun,I will serve rice on the plate.,"{""vocabulary"": [{""word"": ""お皿"", ""reading"": ""おさら"", ""meaning"": ""plate"", ""role"": ""Noun"", ""components"": [], ""combined_explanation"": """"}, {""word"": ""に"", ""reading"": ""に"", ""meaning"": ""[Location/Direction Marker]"", ""role"": ""Particle"", ""components"": [], ""combined_explanation"": """"}, {""word"": ""ご飯"", ""reading"": ""ごはん"", ""meaning"": ""rice"", ""role"": ""Noun"", ""components"": [], ""combined_explanation"": """"}, {""word"": ""を"", ""reading"": ""を"", ""meaning"": ""[Object Marker]"", ""role"": ""Particle"", ""components"": [], ""combined_explanation"": """"}, {""word"": ""盛ります"", ""reading"": ""もります"", ""meaning"": ""will serve"", ""role"": ""Verb, non-past form"", ""components"": [], ""combined_explanation"": """"}], ""grammar"": {""context"": ""This sentence describes an action where the speaker intends to serve rice on a plate. It conveys a simple action in a polite manner, suitable for everyday conversation."", ""steps"": [""**お皿** - Refers to the object where the rice will be served."", ""**に** - Indicates the direction or location of the action, meaning “on” or “to.”"", ""**ご飯** - Specifies the food being served, which is rice."", ""**を** - Marks “ご飯” as the direct object of the verb."", ""**盛ります** - The non-past form of “盛る,” indicating the action of serving is intended to happen in the future.""], ""sentence_pattern"": ""- [Object] + [に] + [Location] + [を] + [Verb (non-past)]\n- **Kanji**: 彼はテーブルにサラダを盛ります。\n- **Hiragana**: かれはてーぶるにさらだをもります。\n- **English Translation**: He will serve salad on the table."", ""sentence_pattern_kanji"": ""彼はテーブルにサラダを盛ります。"", ""sentence_pattern_hiragana"": ""かれはてーぶるにさらだをもります。"", ""sentence_pattern_english"": ""He will serve salad on the table."", ""contribution"": """"}, ""tips"": {""tip"": ""Remember that に indicates the location where the action takes place, while を marks the object of the action. This helps clarify what is being served and where."", ""common_mistake"": ""Beginners often confuse に and へ. While both can indicate direction, に is used for specific locations (like on a plate), whereas へ indicates a general direction."", ""alternative_expression"": {""kanji"": ""お皿にご飯を載せます。"", ""hiragana"": ""おさらにごはんをのせます。"", ""english"": ""I will place rice on the plate.""}, ""new_words_in_alternative"": [{""word"": ""載せます"", ""reading"": ""のせます"", ""meaning"": ""to place"", ""description"": ""Verb, non-past form""}]}}",Vocab,4,"plate, dish",,お皿にご飯を盛ります。,
N5,,,広い,ひろい,I-adjective (keiyoushi),This room is spacious.,"{""vocabulary"": [{""word"": ""この"", ""reading"": ""この"", ""meaning"": ""this"", ""role"": ""Demonstrative adjective"", ""components"": [], ""combined_explanation"": """"}, {""word"": ""部屋"", ""reading"": ""へや"", ""meaning"": ""room"", ""role"": ""Noun"", ""components"": [], ""combined_explanation"": """"}, {""word"": ""は"", ""reading"": ""は"", ""meaning"": ""[Topic Marker]"", ""role"": ""Particle"", ""components"": [], ""combined_explanation"": """"}, {""word"": ""広い"", ""reading"": ""ひろい"", ""meaning"": ""spacious"", ""role"": ""Adjective"", ""components"": [], ""combined_explanation"": """"}, {""word"": ""です"", ""reading"": ""です"", ""meaning"": ""is"", ""role"": ""Copula"", ""components"": [], ""combined_explanation"": """"}], ""grammar"": {""context"": ""This sentence describes the quality of a specific room, indicating that it has a spacious characteristic. It is a simple statement about the room's size."", ""steps"": [""**この** - Specifies the noun that follows, indicating that it is something close to the speaker (this)."", ""**部屋** - The subject of the sentence, referring to the room."", ""**は** - Marks “部屋” as the topic of the sentence."", ""**広い** - An adjective describing the room, meaning spacious."", ""**です** - A polite ending that functions as the copula, linking the subject to the adjective.""], ""sentence_pattern"": ""- [Demonstrative] + [Noun] + [は] + [Adjective] + [です]\n- **Kanji**: あの部屋は狭いです。\n- **Hiragana**: あのへやはせまいです。\n- **English Translation**: That room is small."", ""sentence_pattern_kanji"": ""あの部屋は狭いです。"", ""sentence_pattern_hiragana"": ""あのへやはせまいです。"", ""sentence_pattern_english"": ""That room is small."", ""contribution"": """"}, ""tips"": {""tip"": ""Remember that この indicates something close to the speaker, while あの indicates something further away. This helps in distinguishing between different objects or locations."", ""common_mistake"": ""Beginners often confuse the use of は and が. In this context, は is used to mark the topic (the room), while が is typically used for the subject of a sentence."", ""alternative_expression"": {""kanji"": ""この部屋は大きいです。"", ""hiragana"": ""このへやはおおきいです。"", ""english"": ""This room is large.""}, ""new_words_in_alternative"": [{""word"": ""大きい"", ""reading"": ""おおきい"", ""meaning"": ""large"", ""description"": ""Adjective""}]}}",Vocab,4,spacious; wide; broad,,この部屋は広いです。,
N5,,,痛い,いたい,I-adjective (keiyoushi),My head hurts.,"{""vocabulary"": [{""word"": ""私"", ""reading"": ""わたし"", ""meaning"": ""I"", ""role"": ""Pronoun"", ""components"": [], ""combined_explanation"": """"}, {""word"": ""の"", ""reading"": ""の"", ""meaning"": ""[Possessive Marker]"", ""role"": ""Particle"", ""components"": [], ""combined_explanation"": """"}, {""word"": ""頭"", ""reading"": ""あたま"", ""meaning"": ""head"", ""role"": ""Noun"", ""components"": [], ""combined_explanation"": """"}, {""word"": ""が"", ""reading"": ""が"", ""meaning"": ""[Subject Marker]"", ""role"": ""Particle"", ""components"": [], ""combined_explanation"": """"}, {""word"": ""痛い"", ""reading"": ""いたい"", ""meaning"": ""hurts"", ""role"": ""Adjective"", ""components"": [], ""combined_explanation"": """"}, {""word"": ""です"", ""reading"": ""です"", ""meaning"": ""is"", ""role"": ""Copula"", ""components"": [], ""combined_explanation"": """"}], ""grammar"": {""context"": ""This sentence expresses a personal feeling of discomfort, specifically indicating that the speaker is experiencing pain in their head. It is a straightforward way to communicate a common health issue."", ""steps"": [""**私** - Refers to the speaker, indicating who is experiencing the pain."", ""**の** - Indicates possession, linking “私” (I) to “頭” (head), meaning “my head.”"", ""**頭** - The subject of the sentence, specifying the part of the body that hurts."", ""**が** - Marks “頭” as the subject of the verb."", ""**痛い** - An adjective that describes the state of the subject (the head), indicating that it hurts."", ""**です** - A polite ending particle that adds formality to the sentence.""], ""sentence_pattern"": ""- [Subject (私の頭)] + [が] + [Adjective (痛い)] + [です]\n- **Kanji**: 彼の手が冷たいです。\n- **Hiragana**: かれのてがつめたいです。\n- **English Translation**: His hand is cold."", ""sentence_pattern_kanji"": ""彼の手が冷たいです。"", ""sentence_pattern_hiragana"": ""かれのてがつめたいです。"", ""sentence_pattern_english"": ""His hand is cold."", ""contribution"": """"}, ""tips"": {""tip"": ""Remember that の is used to indicate possession, so 私の means \""my.\"" This structure is common in Japanese to express ownership."", ""common_mistake"": ""Beginners often confuse が and は. In this context, が is used to mark the subject (the head that hurts), while は would imply a broader topic, which is not necessary here."", ""alternative_expression"": {""kanji"": ""頭が痛い。"", ""hiragana"": ""あたまがいたい。"", ""english"": ""My head hurts. (more casual)""}, ""new_words_in_alternative"": [{""word"": ""痛い"", ""reading"": ""いたい"", ""meaning"": ""hurts"", ""description"": ""Adjective""}]}}",Vocab,4,hurt; painful; sore,,私の頭が痛いです。,
N5,,,お風呂,おふろ,Noun,I take a bath every night.,"{""vocabulary"": [{""word"": ""毎晩"", ""reading"": ""まいばん"", ""meaning"": ""every night"", ""role"": ""Adverbial phrase"", ""components"": [{""part"": ""毎"", ""reading"": ""まい"", ""meaning"": ""every"", ""contribution"": ""Adverb""}, {""part"": ""晩"", ""reading"": ""ばん"", ""meaning"": ""night"", ""contribution"": ""Noun""}], ""combined_explanation"": """"}, {""word"": ""お風呂"", ""reading"": ""おふろ"", ""meaning"": ""bath"", ""role"": ""Noun"", ""components"": [{""part"": ""風呂"", ""reading"": ""ふろ"", ""meaning"": ""bath"", ""contribution"": ""Noun""}], ""combined_explanation"": """"}, {""word"": ""に"", ""reading"": ""に"", ""meaning"": ""[Direction/Location Marker]"", ""role"": ""Particle"", ""components"": [{""part"": ""入る"", ""reading"": ""はいる"", ""meaning"": ""to enter"", ""contribution"": ""Verb""}], ""combined_explanation"": """"}], ""grammar"": {""context"": ""This sentence describes a habitual action where the speaker regularly takes a bath every night. It emphasizes the routine nature of this activity."", ""steps"": [""**毎晩** - Indicates the frequency of the action, meaning “every night.”"", ""**お風呂** - Specifies what the action is related to, which is “bath.”"", ""**に** - Marks the direction or target of the action, indicating where the speaker is entering."", ""**入ります** - The polite present tense form of the verb “入る,” indicating the action of entering or taking a bath.""], ""sentence_pattern"": ""- [Frequency] + [Noun] + [に] + [Verb (present tense)]\n- **Kanji**: 毎晩お風呂に入ります。\n- **Hiragana**: まいばんおふろにはいります。\n- **English Translation**: I take a bath every night."", ""sentence_pattern_kanji"": ""毎晩お風呂に入ります。"", ""sentence_pattern_hiragana"": ""まいばんおふろにはいります。"", ""sentence_pattern_english"": ""I take a bath every night."", ""contribution"": """"}, ""tips"": {""tip"": ""Remember that 毎晩 indicates frequency, which is essential for understanding how often the action occurs. Associating it with a routine can help you remember its meaning."", ""common_mistake"": ""Beginners might confuse the use of に with other particles like で or へ. Remember that に indicates the target or direction of the action, while で indicates the means or location of the action."", ""alternative_expression"": {""kanji"": ""毎晩お風呂に入る。"", ""hiragana"": ""まいばんおふろにはいる。"", ""english"": ""I take a bath every night. (This is a more casual expression without the polite form.)""}, ""new_words_in_alternative"": [{""word"": ""入る"", ""reading"": ""はいる"", ""meaning"": ""to enter"", ""description"": ""Verb""}]}}",Vocab,4,a bath,,毎晩お風呂に入ります。,
N5,,,灰皿,はいざら,Noun,There is an ashtray on the table.,"{""vocabulary"": [{""word"": ""テーブル"", ""reading"": ""てーぶる"", ""meaning"": ""table"", ""role"": ""Noun"", ""components"": [], ""combined_explanation"": """"}, {""word"": ""の"", ""reading"": ""の"", ""meaning"": ""[Possessive/Attributive particle]"", ""role"": ""Particle"", ""components"": [], ""combined_explanation"": """"}, {""word"": ""上"", ""reading"": ""うえ"", ""meaning"": ""on / above"", ""role"": ""Noun"", ""components"": [], ""combined_explanation"": """"}, {""word"": ""に"", ""reading"": ""に"", ""meaning"": ""[Location/Direction particle]"", ""role"": ""Particle"", ""components"": [], ""combined_explanation"": """"}, {""word"": ""灰皿"", ""reading"": ""はいざら"", ""meaning"": ""ashtray"", ""role"": ""Noun"", ""components"": [], ""combined_explanation"": """"}, {""word"": ""が"", ""reading"": ""が"", ""meaning"": ""[Subject Marker]"", ""role"": ""Particle"", ""components"": [], ""combined_explanation"": """"}, {""word"": ""あります"", ""reading"": ""あります"", ""meaning"": ""there is"", ""role"": ""Verb, non-past"", ""components"": [], ""combined_explanation"": """"}], ""grammar"": {""context"": ""This sentence describes the presence of an ashtray located on a table. It provides a clear spatial relationship between the ashtray and the table."", ""steps"": [""**テーブルの上** - Refers to the location, meaning \""on the table.\"""", ""**に** - Marks the location where the ashtray exists."", ""**灰皿** - Specifies the object that exists."", ""**が** - Marks “灰皿” as the subject of the sentence."", ""**あります** - Indicates the existence of the ashtray in a polite form.""], ""sentence_pattern"": ""- [Location] + [に] + [Subject] + [が] + [Verb (existence)]\n- **Kanji**: 部屋の中に猫がいます。\n- **Hiragana**: へやのなかにねこがいます。\n- **English Translation**: There is a cat in the room."", ""sentence_pattern_kanji"": ""部屋の中に猫がいます。"", ""sentence_pattern_hiragana"": ""へやのなかにねこがいます。"", ""sentence_pattern_english"": ""There is a cat in the room."", ""contribution"": """"}, ""tips"": {""tip"": ""Remember that the particle に indicates the location of existence, while が marks the subject of the sentence. This structure helps clarify where something is located."", ""common_mistake"": ""Beginners often confuse the use of に and で. Remember that に is used for indicating a location where something exists, while で is used to indicate the location of an action."", ""alternative_expression"": {""kanji"": ""テーブルの上に置いてある灰皿です。"", ""hiragana"": ""てーぶるのうえにおいてあるはいざらです。"", ""english"": ""It is an ashtray placed on the table.""}, ""new_words_in_alternative"": [{""word"": ""置いてある"", ""reading"": ""おいてある"", ""meaning"": ""placed"", ""description"": ""Verb, non-past""}]}}",Vocab,4,a container for ashes from cigarettes or other smoking materials,,テーブルの上に灰皿があります。,
N5,,,シャツ,シャツ,Noun,I bought a new shirt.,"{""vocabulary"": [{""word"": ""私"", ""reading"": ""わたし"", ""meaning"": ""I"", ""role"": ""Pronoun"", ""components"": [], ""combined_explanation"": """"}, {""word"": ""は"", ""reading"": ""は"", ""meaning"": ""[Topic Marker]"", ""role"": ""Particle"", ""components"": [], ""combined_explanation"": """"}, {""word"": ""新しい"", ""reading"": ""あたらしい"", ""meaning"": ""new"", ""role"": ""Adjective"", ""components"": [], ""combined_explanation"": """"}, {""word"": ""シャツ"", ""reading"": ""しゃつ"", ""meaning"": ""shirt"", ""role"": ""Noun"", ""components"": [], ""combined_explanation"": """"}, {""word"": ""を"", ""reading"": ""を"", ""meaning"": ""[Object Marker]"", ""role"": ""Particle"", ""components"": [], ""combined_explanation"": """"}, {""word"": ""買いました"", ""reading"": ""かいました"", ""meaning"": ""bought"", ""role"": ""Verb, past tense"", ""components"": [{""part"": ""買う"", ""reading"": ""かう"", ""meaning"": ""to buy"", ""contribution"": ""Verb""}], ""combined_explanation"": """"}], ""grammar"": {""context"": ""This sentence conveys that the speaker has completed the action of buying a new shirt. It indicates a personal experience in the past."", ""steps"": [""**私** - Refers to the speaker, marking them as the subject of the sentence."", ""**は** - Marks “私” as the topic of the sentence."", ""**新しい** - Describes the noun “シャツ” as being new."", ""**シャツ** - The object of the action, indicating what was bought."", ""**を** - Marks “シャツ” as the direct object of the verb."", ""**買いました** - The polite past tense form of “買う,” indicating that the action of buying has been completed.""], ""sentence_pattern"": ""- [Subject] + [は] + [Adjective] + [Noun] + [を] + [Verb (past tense)]\n- **Kanji**: 彼は美味しいケーキを食べました。\n- **Hiragana**: かれはおいしいけーきをたべました。\n- **English Translation**: He ate a delicious cake."", ""sentence_pattern_kanji"": ""彼は美味しいケーキを食べました。"", ""sentence_pattern_hiragana"": ""かれはおいしいけーきをたべました。"", ""sentence_pattern_english"": ""He ate a delicious cake."", ""contribution"": """"}, ""tips"": {""tip"": ""Remember that は marks the topic of the sentence, which helps to clarify who is performing the action. In this case, it’s “I” who bought something."", ""common_mistake"": ""Beginners often confuse を with は. Remember that を is used to mark the direct object of the verb, while は marks the topic of the sentence."", ""alternative_expression"": {""kanji"": ""私は新しいシャツを買った。"", ""hiragana"": ""わたしはあたらしいしゃつをかった。"", ""english"": ""I bought a new shirt. (less formal)""}, ""new_words_in_alternative"": [{""word"": ""買った"", ""reading"": ""かった"", ""meaning"": ""bought"", ""description"": ""Verb, past tense""}]}}",Vocab,4,shirt,,私は新しいシャツを買いました。,
N5,,,結構,けっこう,Na-adjective (keiyodoshi),This cake is quite delicious.,"{""vocabulary"": [{""word"": ""この"", ""reading"": ""この"", ""meaning"": ""this"", ""role"": ""Demonstrative adjective"", ""components"": [], ""combined_explanation"": """"}, {""word"": ""ケーキ"", ""reading"": ""けーき"", ""meaning"": ""cake"", ""role"": ""Noun"", ""components"": [], ""combined_explanation"": """"}, {""word"": ""は"", ""reading"": ""は"", ""meaning"": ""[Topic Marker]"", ""role"": ""Particle"", ""components"": [], ""combined_explanation"": "" **結構 (けっこう)**: “quite” or “fairly” - [Adverb]""}, {""word"": ""おいしい"", ""reading"": ""おいしい"", ""meaning"": ""delicious"", ""role"": ""Adjective"", ""components"": [], ""combined_explanation"": """"}, {""word"": ""です"", ""reading"": ""です"", ""meaning"": ""is"", ""role"": ""Copula"", ""components"": [], ""combined_explanation"": """"}], ""grammar"": {""context"": ""This sentence describes the speaker's opinion about a specific cake, indicating that they find it to be quite tasty. It expresses a positive evaluation of the cake."", ""steps"": [""**この** - Specifies the cake being referred to, indicating it is close to the speaker."", ""**ケーキ** - The subject of the sentence, which is the cake."", ""**は** - Marks “ケーキ” as the topic of the sentence."", ""**結構** - Modifies the adjective to indicate a degree of deliciousness, suggesting it is more than just good."", ""**おいしい** - The main descriptive word that conveys the quality of the cake."", ""**です** - A polite ending that functions as the verb “is,” making the sentence more formal.""], ""sentence_pattern"": ""- [Demonstrative] + [Noun] + [は] + [Adverb] + [Adjective] + [です]\n- **Kanji**: このケーキはとてもおいしいです。\n- **Hiragana**: このけーきはとてもおいしいです。\n- **English Translation**: This cake is very delicious."", ""sentence_pattern_kanji"": ""このケーキはとてもおいしいです。"", ""sentence_pattern_hiragana"": ""このけーきはとてもおいしいです。"", ""sentence_pattern_english"": ""This cake is very delicious."", ""contribution"": """"}, ""tips"": {""tip"": ""Remember that は marks the topic of the sentence, which helps to clarify what you are talking about. In this case, it emphasizes that the cake is the focus of the statement."", ""common_mistake"": ""Beginners may confuse これ (this) with この (this), which is used to modify nouns. Remember that この is used directly before a noun to specify it."", ""alternative_expression"": {""kanji"": ""このケーキはかなりおいしいです。"", ""hiragana"": ""このけーきはかなりおいしいです。"", ""english"": ""This cake is rather delicious.""}, ""new_words_in_alternative"": []}}",Vocab,4,quite; fairly; enough,,このケーキは結構おいしいです。,
